,title,company,location,salary,summary
115,Digital Audit - Data Scientist Senior Associate,PwC,London,,"PhD/Post Doc or experience of Degree in Computer science, Machine learning or Data science.Experience of working cloud services for e.g Microsoft Azure, Google…"
116,newSenior Data Scientist,GSK,Brentford,,"Have a practical understanding of machine learning, Deep Learning and natural language understanding/processing or speech recognition."
117,newSenior ML Engineer,GSK,Brentford,,"Knowledge of productionising machine learning, Deep Learning and natural language understanding/processing models."
118,Senior Software Engineer - Machine Learning - TR Labs,Thomson Reuters,London E14,,"Extensive software engineering experience, ideally in the context of machine learning and natural language processing."
119,Conversation Designer,Flo Health,Hybrid remote in London,,Creating/optimising Health Assistant dialogues and any embedded content that solves a user problem or need.Working with the Product Manager and Content Lead to…
120,Staff Product Designer,Intercom,London,,Work closely with other product designers on the team to support them as they clarify the problem they are solving and define the best solution for that problem…
121,CTO,Provar Testing,Remote in London,,"A minimum of a bachelor's degree in computer science (or similar), or equivalent experience.Competence with multiple programming languages, including Java and…"
122,Business Development Representative,Yext,London,,BA/BS degree or similar college level education.1+ years in the BDR function or relevant work experience.Research accounts and contacts to develop compelling…
123,Technical Content Designer (Technical Writer),Anaplan,London,,Working with enterprise business planning or financial data.3 days of paid leave every year to help support a charity or cause of your choice.
124,Project Manager (UK Based),conversationHEALTH,Remote in London,,"Bachelor’s degree in engineering, computer science or related field, or equivalent work experience.You will be working closely with Client Success directors to…"
125,Project Manager - Remote Europe,Typeform,Remote in London,,Experience in managing designers and other creatives.Forecast resourcing needs and identify over or under capacity.Experience working in agile environments.
126,SENIOR UX DESIGNER,Rehabstudio,Temporarily Remote in London E1,,"Experience designing for conversational interfaces.Creating user journey maps, service blueprints, reports.This is a key role within the business and you will…"
127,Business Development Director,Nexus Frontier Tech,London E1W,,Experience selling AI or automation solutions.Nexus Frontier Tech makes AI easy for organisations by using natural language processing to transform idle…
128,Account Executive,Affinity,London,,"Selling to financial services companies such as VC, CVC, and PE.In this role, you'll be responsible for building and closing a pipeline of net new accounts in…"
129,Associate Customer Success Manager,ThoughtSpot,Remote in London,,"You strive to provide excellent user experiences and service to our customers.Experience in a software company, an applications vendor, SaaS, or Data Analytics…"
130,Software Engineer,Yext,London,,"BS or above in Computer Science, a related field, or similar college level education.Our team includes Project Management, Creative, and Software Engineering…"
131,Software Engineering Manager (Engage),Intercom,London,,"We build solutions for conversational marketing, conversational support and conversational engagement through our business messenger, management tools and…"
132,Staff Engineer,Tractable,London,,Kubernetes and Docker to schedule and run our services.Working in a cross-functional team supporting the design and development of our bleeding edge platform…
133,Business Analyst & Change Manager,Intent HQ,London SW1Y,,Experience working with JIRA or similar tools.26 days holiday (increasing with service).Proficiency in Excel or other data processing and analytics tools.
134,Senior Account Manager,Nexus Frontier Tech,London E1W,,MBA or relevant business qualification.Outstanding written and conversational skills.Deep understanding of the financial services sector.
135,Senior Design Manager,Intercom,Remote in London,,"Helping to shape the future vision of products and driving strategic design work in exciting areas, such as conversational design, messengers, machine learning…"
136,Engineering Manager,Tractable,Temporarily Remote in London,,Someone with one or more years of experience managing Engineers.Strong backend programming skills (ideally fullstack) in any OO language.
137,Enterprise Account Executive,Eigen Technologies,London,,"Incorporate customer perspective, drivers, and product/service relevancy to deliver persuasive client presentations.Experience managing complex sales cycles."
138,Sales Engineer,ThoughtSpot,Remote in London,,"Experience with BI tools such as MicroStrategy, Tableau, Looker or similar.With ThoughtSpot's developer-friendly platform, customers can also embed consumer…"
139,Senior Software Engineer,Tractable Global,London,,Strong backend skills (in any object oriented language).This system will sit on top of our existing infrastructure and will provide a platform through which…
140,Senior Sales Engineer,Yext,London,,BA/BS degree required or similar college level education; MBA a plus.Sales and/or pre-sales experience with SaaS/Cloud products; experience in a marketing…
141,"Senior Client Success Manager, Enterprise",Yext,London,,"BA/BS degree or similar college level education.Blend of consulting, search, technological and/or display experience."
142,Senior Recruiter,Yext,London,,"BA/BS degree or similar college level education; in lieu of degree, ideally 5 years relevant work experience.Excellent verbal and written communication skills."
143,Amazon Connect Lead Developer,Uniting People,London,,"Well versed with AWS platform and technology services.Need to have some project management skills, or have led a team in the past and managed different…"
144,Software Engineer,Yepic AI,London W1K,,Experience with Celery or other job orchestration systems.Experience of using various database platforms (SQL or NoSQL).2+ year REST API experience.
145,"Software Engineer, Customer Engineering",Tractable,London,,Excellent coding skills using mainly object oriented programming languages (preferably Python and/or Typescript).Skills/experience we're looking for:
146,Senior Tools Backend Engineer (Remote - Europe),Typeform,Remote in London,,You have several years of professional experience as a Backend or Full Stack Engineer.You will report to Engineering Manager - Corporate.
147,Lead Data Engineer,Faethm,London WC2R,,You may have exposure to natural language processing models like BERT or graph convolution networks.Confident working with a range of cloud services on AWS and…
148,"Principal Delivery Manager, EMEA",Tractable,London,,"7+ years years experience in managing cloud-based or hybrid software implementation projects, ideally in a vendor or consultancy."
149,AWS Solution Architect with Amazon Connect,Tata Consultancy Services (TCS),London,,Well versed with AWS platform and technology services.Accountable for ensuring solution designs are aligned to enterprise architecture standards and principles…
