,title,company,salary,summary
125,Junior Consultant Marketing Strategy & Digital Transformatio...,Sia Partners,,"Sia Partners is a next generation management consulting firm and pioneer of Consulting 4.0.We offer a unique blend of AI and design capabilities, augmenting…"
126,Head of Sales,Young Mavericks,,"Bij Young Mavericks zijn we opzoek naar een Head of Sales om ons team te komen versterken.Full-time · Kattenburgerstraat 5, Amsterdam."
127,Software Engineering Intern,Databricks,,"At Databricks, we are passionate about helping data teams solve the world's toughest problems — from making the next mode of transportation a reality to…"
128,Talent Business Partner,Quin,,“Everyone at Quin is driven by the same mission:Building AI-solutions that will transform healthcare.”.Help us build the future of healthcare.
129,Front End Developer,Quin,,"""At Quin, we're not just writing code; we write quality code that impacts lives."".Vladyslav, Chapter Lead Front End Team.+ Make (grand)ma proud ;-)."
130,BRP Specialist,Gemeente Diemen,€4.048 per maand,Bij Burgerzaken kan jij je liefde voor dienstverlening en klantgerichtheid mooi combineren.Daarnaast ondersteun en coach je collega's.
131,Frontend Engineer,Lemonade Insurance Company,,"If you’re a true tech geek, creative thinker, and a CSS pro, read on.3+ years experience working as a frontend engineer."
132,EMEA Threat Management Consultant,IBM,,"In this role, you will engage with customers helping them establish their overall threat management journey, shape how they want to operate in the future and…"
133,nieuwSAP S/4HANA Associate Partner,IBM,,"IBM is a global Systems Integrator and longlasting SAP partner, providing innovative and differentiated service offerings to both existing and new SAP clients…"
134,Project Analist,iBOOD,,"Deze persoon werkt vanuit de data om vervolgens projecten te initiëren, teams samen te stellen die aan de hand van de gevonden data verandering kunnen brengen…"
135,SAP Production Planning Consultant,IBM,,"Our team takes on the challenge of designing, developing and re-engineering highly complex application components and integrating software packages using…"
136,nieuwMedior Bouwkunde/ Architectural Engineer,Bilfinger,,Onze engineers en consultants lopen voorop in het realiseren van industriële investeringsprojecten.Je maakt deel uit van de afdeling ‘Architectural/Bouwkunde”…
137,Data Engineer,Klue,€65.000 - €110.000 per jaar,We’re a team of highly skilled software engineers and data scientists based out of Amsterdam and Vancouver.A set of automated pipelines for data collection and…
138,Cloud Applications Business Development Executive,IBM,,You will guide clients and solution sales teams in the adoption of Hybrid Cloud and sell services on top of this Hybrid Cloud platform.
139,Junior Business Consultant,Knowledge Values,,Business Consultants in Knowledge Values are challenged to identify business needs and provide our clients with best practices and high quality solutions…
140,Corporate Communications Manager,Signify,,Deputizing for the Chief Press Officer.Drafting news releases and pitching to the media.Managing interns in developing on our digital news summary service…
141,nieuwJunior Infrastructure Engineer,Bilfinger,,Onze engineers en consultants lopen voorop in het realiseren van industriële investeringsprojecten.Jouw standplaats is Velsen- Noord en je maakt deel uit van…
142,Marketing & Events Intern,Careers at Growth Tribe,,"*40% Managing speaker availability, communication and logistics: *.Managing the promotion planning and content.Available full-time and ASAP."
143,Strategy Manager,Signify,,"As a Strategy Manager, you’ll be responsible for the development of strategies to support Leadership, Markets, Divisions, and management teams in resolving…"
144,Account Support Specialist,Nestlé,,"Als Account Support Specialist ben je een belangrijke spil binnen de Commercial Division.Correcte facturatie, bonusberekeningen en promotieplanning en verzorg…"
