,title,company,location,salary,summary
0,Creative Technologist,Burberry,London,,Contribute proactively to creative brainstorms and workshops.Support creative team with the “art of the possible”.
1,Head of Production - Creative Lab EU - GBM,TikTok,London,,"Sell production as a creative resource and ensure production starts upstream.You will cultivate a collaborative environment in which producers, technologists,…"
2,PA to creative director/founder,Jason Bruges Studio,London,,"Experience within a busy creative environment.He leads a pioneering team of architects, designers, creative technologists, programmers, computational designers…"
3,Middle Creative,"The Ogilvy Group, LLC",Hybrid remote in London SE1,,25 days annual leave + 1 Volunteer Day.We have a flexible working policy with core working hours (10am – 4pm) and have launched our 2 Hybrid Working model.
4,Architectural Technologist,HLM Architects,London E1,,You will have good technical skills and be able to work as part of a team efficiently.Working as an Architectural Technologist on UK and international projects…
5,Creative Technologist,Syneos Health Commercial Solutions,London,,The Creative Technologist is responsible for producing creative and innovative offerings in the healthcare space for Syneos Health EU Communications.
6,Software Engineering,"JPMorgan Chase Bank, N.A.",London,,"BS/BA degree or equivalent experience.Mastery of application, data, and infrastructure architecture disciplines."
7,Childrenswear Garment Technologist,Burberry,London,,"Understanding of production methods, production cycle and garment construction.Knowledge of global CHW safety requirements and legislation."
8,newArchitectural technologist,Brewer Smith Brewer Group,London,,"Our architectural expertise is dependent upon the adoption of a highly creative outlook, combined with a methodical and technically astute approach."
9,newApplication Integration Engineer - Client Connectivity,Morgan Stanley,London,,EDUCATION LEVEL: Bachelor's Degree.JOB: Production Management and Operational Support.Client Connectivity Services is responsible for the global connectivity…
10,"Creative Technologist, Global Marketing Innovation",Universal Music Group,London N1C,,Actively participate in creative brainstorm sessions related to social media platforms and artist campaigns.Proven track record in a similar role.
11,Development Technologist,Bakkavor,London,"£28,000 a year",Innovate new products and processes in response to customer briefs to maintain and grow a creative catalogue of products for our customers.
12,newRadiopharmacy - Quality Assurance Manager,Barts Health NHS Trust,London EC1A,"£54,223 - £60,316 a year",The post-holder should possess creative problem solving skills and the motivation to adopt and drive change.The successful candidate will undertake and oversee…
13,newSponsorships and Events Manager - Chase UK,"JPMorgan Chase Bank, N.A.",London,,This role will have the advantage of working in a highly collaborative and agile marketing tribe and would appeal to someone used to working with multiple…
14,"Editorial Intern, Strategist UK","Vox Media, LLC",London,,The ideal candidate must be able to work 4 days per week (32 hours per week) for 3 months.Updating a selection of top-trafficked stories with alternative links…
15,newKnitwear & Jersey Designer,Alfred Dunhill,London,,"To interface with garment technologists w. regards to size specifications, technical construction, and the suitability of fabric for end use."
16,Architectural Technician (London),Eat Work Art,London,,"You will be expected to produce the technical documents required for Building Regulations, tender and construction and have experience of contract…"
17,newCreative Manager (Brand Partnerships),Universal Music Group,London N1C,,"They have their finger on the pulse of creative trends in digital marketing.Exceptional design aesthetic, ensuring all creative output adheres to brand and…"
18,newSenior architect/technologist,Brewer Smith Brewer Group,London,,"Our architectural expertise is dependent upon the adoption of a highly creative outlook, combined with a methodical and technically astute approach."
19,newDesigner,Nesta,Hybrid remote in London,,"With the remainder focused on being part of a Nesta-wide community of designers and technologists, your own professional development and furthering Nesta’s…"
20,"Senior Manager, Contact Centre Technologist, Deloitte Digita...",Deloitte,London,,"Including: customer and channel strategy, customer experience design, designing new service capabilities and operations, mobile, online and contact centre…"
21,newCorporate Responsibility Marketing Manager,"JPMorgan Chase Bank, N.A.",London,,"This position would suit someone who is dynamic, creative and passionate about our communities, driving brand purpose and delivering high impact through-the…"
22,Client Services Assistant,Deluxe Media,London,,Reports to Client Services and Traffic manager.Runners are required to support to our Client Services Manager in providing a high calibre hospitality service…
23,Junior Art Director,HAVI,London SE1,,Demonstrates an interest in agency-wide projects outside the creative department.Navigate briefing sessions in a way that sets up the creative process for…
24,Fabrication Lab Technologist: Software Developer,University of Westminster,London,,"We are looking for staff with a creative approach to innovative and experimental work, and a desire to keep developing in this rapidly expanding area."
25,frog - Midweight Service Designer,Capgemini Invent,London,,"Frog partners with customer-centric enterprises to drive sustainable growth, by building and orchestrating experiences at scale, while harnessing the power of…"
26,"newSenior Design Technologist , Alexa Shopping",Amazon UK Services Ltd.,London,,"Familiar with creative ideation and brainstorm sessions with internal and external partners.Familiarity with Augmented Reality, Virtual Reality, Alexa, Voice…"
27,newfrog - Brand Designer,Capgemini Invent,London,,"Work closely with senior team members to execute the design craft and creative vision.You have a proven ability to produce cutting edge creative work, and a…"
28,Design Ops - Studio Operations and Tooling Manager,"JPMorgan Chase Bank, N.A.",London,,"Our growing 200+ Digital Experience Design team (DXD) includes UX and visual designers, service designers, researchers and creative technologists spread across…"
29,Junior Product Designer - QuantumBlack Labs,McKinsey & Company,London,,"These tools draw on the latest insights from our client work and research & development efforts, and deliver solutions as part of delightful experiences."
30,Lead Facilitator (ASE),Capgemini,Hybrid remote in London,,"You will be supporting our clients to drive transformation across their business, coach and guide senior leaders to be bold, as well as playing an integral part…"
31,Architectural Technologist,AECOM,Hybrid remote in London,,"We are offering a competitive salary plus generous benefits, and the opportunity to work on a variety of exciting projects in a wide range of sectors."
32,Strategists Wanted!,RAPP,London,,"Strong creative judgement and an opinion.RAPP is an integral part of Omnicom’s Precision Marketing Group, comprising 4,000 creatives, technologists,…"
33,"Software Architect, Global Banking Platform (London)","JPMorgan Chase Bank, N.A.",London,,"With your deep knowledge of software design, analysis, development, testing, and operations, your will have technology leadership role to build and shape a high…"
34,Strategy Manager,BBC,Hybrid remote in London W1A,,"We are a creative, innovative team drawing on data, insight and information to help advise BBC management on how the BBC’s content and services should evolve."
35,Global Platform Lead (Asset Movements),"JPMorgan Chase Bank, N.A.",London,,You will lead a highly inspired and inquisitive team of technologists who are already developing and deploying applications to the highest standards.
36,Office of AI Scholarship - QuantumBlack,McKinsey & Company,London,,These tools draw on the latest insights from our client work and research & development efforts and deliver solutions as part of delightful experiences.
37,Equities Technology Business Management Support - Associate,"JPMorgan Chase Bank, N.A.",London,,Primary function of the role is to provide comprehensive financial and strategic support to the Equities Technology organization.
38,newMid-Level Creative,Jack Morton,London,,"You will work closely with a diverse and talented team of designers, strategists, film and content makers and technologists."
39,frog - MarTech Consultant,Capgemini Invent,London,,"Frog partners with customer-centric enterprises to drive sustainable growth, by building and orchestrating experiences at scale, while harnessing the power of…"
40,Account Management,RAPP,London,,"RAPP is an integral part of Omnicom’s Precision Marketing Group, comprising 4,000 creatives, technologists, strategists, and data and marketing scientists…"
41,Financial Services Consultant - Non-Financial Risk & Regulat...,Capgemini Invent,London,,"By combining strategy, technology, data science, and creative design expertise with an inventive mindset, we partner with our clients to innovate and transform…"
42,Management Consultant - Workforce Transformation,Capgemini Invent,London,,"By combining strategy, technology, data science, and creative design expertise with an inventive mindset, we partner with our clients to innovate and transform…"
43,newC++ Developer,Morgan Stanley,London,,Pragmatic and creative problem-solving skills and a positive attitude.We are seeking strong technologists with C++ skills in a Linux server-side environment.
44,newMarketing Researcher - Employer Brand,PeopleScout,London,,"An integral part of the team, you'll conduct qualitative research activities (focus groups, 1-2-1 interviews, workshops), that will help us provide analysis and…"
45,frog - Senior Service Designer,Capgemini Invent,London,,Comfort working closely with product designers and technologists.Enough tech and digital know-how to hold a high-level conversation with a technologist.
46,Internal Communications Manager - Chase UK,"JPMorgan Chase Bank, N.A.",London,,Work closely with in-house and agency teams to produce creative assets.JPMorgan Chase's new digital bank in the U.K. is seeking an experienced and talented…
47,"Product Lead, Platinion (Digital BCG)",Boston Consulting Group,London,,This will involve organising & facilitating ideation and incubation sessions to uncover creative and disruptive digital solutions.
48,U.K. Market Lead of SME- Banking and Lending - Chase UK,"JPMorgan Chase Bank, N.A.",London,,"Defining market and revenue opportunities for a specific customer segment, market and/or product.Experience in developing and managing go-to-market plans."
49,VFX Compositor,Deluxe Media,London,,Demonstrate the ability to communicate creative and technical thoughts and ideas.Preferably 12 months+ experience in TV VFX.
50,Personal Assistant,bp,London,,"Engineers, technologists, scientists and entrepreneurs‎.This role reports to VP of Market Platforms & Midstream Digital Portfolio Delivery."
51,Product Engineer / Technologist,Chilly’s,Remote in London,,"You will also be required to oversee the product quality process to ensure that all products are safe, legal and fit for purpose as well as ensuring all…"
52,"Creative Director, Experience Design",Apple,London,,"The ability to collaborate with other team members such as writers, designers, developers and creative technologists."
53,"Business Analyst, Software Asset Management, Global, London",Deloitte,London,,The Software Asset Management (SAM) Analyst position reports directly to the Software Asset Manager.This individual will support the license tracking and…
54,frog - Management Consultant - Marketing,Capgemini Invent,London,,"Frog partners with customer-centric enterprises to drive sustainable growth, by building and orchestrating experiences at scale, while harnessing the power of…"
55,Site Reliability Engineer,"JPMorgan Chase Bank, N.A.",London,,"As a Site Reliability Engineer (SRE) you will help build a meaningful engineering discipline, combining software and systems to develop creative engineering…"
56,"newOffice Manager, UK",Huma,Temporarily Remote in London,,"Ensuring all supplies in the kitchen, stationery cupboard, meeting rooms are well and truly stocked.Visits to the Huma office, whether external or internal,…"
57,newLead Visual Designer - VP,"JPMorgan Chase Bank, N.A.",London,,"Our growing 200+ Digital Experience Design team (DXD) includes UX and visual designers, service designers, researchers and creative technologists spread across…"
58,"newBusiness Architecture and Analysis, Technology Business Anal...",EY,London SE1,,Knowledgeable and capable of conducting and handling requirements of varying complexity through its lifecycle and validating or presenting with business…
59,Freelance Live Unit Subtitler,Deluxe Media,London,,"The department operates a 24 x 7 x 365 service and, as such, there is a requirement to work shifts, which currently include a mixture of weekend and split…"
60,Director - Intelligent Process Excellence,Capgemini Invent,London,,"By combining strategy, technology, data science, and creative design expertise with an inventive mindset, we partner with our clients to innovate and transform…"
61,Product Manager - Healthcare,RAPP,London,,We’re looking for an experienced Product Manager to play a lead role in delivering a high-profile Pharmaceutical website/hub for a global healthcare client.
62,Technologist,Conrad Consulting,Remote in London,,An opportunity now exists for an experienced Architectural Technologist with a passion for high-end residential design to become a part of their collaborative &…
63,newJava Software Engineer - Graphite Payment Management,"JPMorgan Chase Bank, N.A.",London,,"The JP Morgan payment processing platform Graphite is at the very heart of large portion of payments made throughout the world on a daily basis, including…"
64,Creative Technologist / Digital Designer,PLAYGROUND XYZ,London,,Sit in on creative kick-off meetings or brainstorm and offer expert advice.Working with our cutting edge Attention tracking technology to determine best…
65,Quality Assurance Lead,EY,London SE1,,"Have overall responsibility for Quality across a wide portfolio of systems and services.Be responsible for the development, deployment of a standard, robust, …"
66,Testing Assurance Lead,EY,London SE1,,"Have overall responsibility for Testing excellence across a wide portfolio of systems and services.Be responsible for the development, deployment of a standard…"
67,newDirector of Product Design | Sydney-based,Canva,Remote in London,,We understand our community needs; envision the future; and drive the most simple design solutions that integrate across our entire product.
68,"Account Executive, Energy and Technology",Financial Times,London,,Utilise marketing and new business tools e.g. LinkedIn Sales Navigator to drive your own client patch and support the wider Energy and Tech teams’ patches.
69,Management Consultant - Operating Model Strategy - London,Capgemini Invent,London,,"By combining strategy, technology, data science, and creative design expertise with an inventive mindset, we partner with our clients to innovate and transform…"
70,Director - Procurement,Capgemini Invent,London,,"By combining strategy, technology, data science, and creative design expertise with an inventive mindset, we partner with our clients to innovate and transform…"
71,newProject Manager / Fleet Enablement Lead,Morgan Stanley,London,,"The Commodities Technology team is seeking a Project Manager (PMO) and Fleet Enablement Lead (FEL), to support the team in delivering a broad range of trading…"
72,Product Manager - QuantumBlack Labs,McKinsey & Company,London,,"A Collaborative, Multi-disciplinary Environment– Our teams include machine learning engineers, creative technologists, product managers, and designers with…"
73,C++ Engineer - Athena Core,"JPMorgan Chase Bank, N.A.",London,,"It delivers innovative and efficient applications to a wide range of the firm's business, including sales, trading, operations, risk and research."
74,"Client Technology - Business Architecture and Analysis, Tech...",EY,London SE1,,Knowledgeable and capable of conducting and handling requirements of varying complexity through its lifecycle and validating or presenting with business…
75,Management Consultant - Employee Experience & HR 1,Capgemini Invent,London,,"By combining strategy, technology, data science, and creative design expertise with an inventive mindset, we partner with our clients to innovate and transform…"
76,frog - Director - Brand Strategy,Capgemini Invent,London,,"Brand expression development (working closely with creative teams on all elements of brand identity).Comfortable shaping a new business, winning new work and…"
77,newSoftware Developer,Psymplicity Healthcare,London,,"A successful candidate will be creative and innovative, with both strong communication and problem-solving skills.API function building, including MS Graph."
78,frog - Senior Copywriter,Capgemini Invent,London,,"You’ll have a vibrant imagination, a love for language and creative flair.Frog partners with customer-centric enterprises to drive sustainable growth, by…"
79,newCredit eTrading Java Developer,"JPMorgan Chase Bank, N.A.",London,,Our engineers have an aptitude for solving problems with technology and an ability to quickly translate business requirements into a sound technical design and…
80,Succession and Knowledge Management Lead,EY,London SE1,,"Be responsible for the development of a cohesive Succession & Knowledge Management Approach, Strategy, Deployment & Maintenance framework leveraging industry …"
81,"Service Designer, Senior Associate","JPMorgan Chase Bank, N.A.",London,,"DXD includes product designers, UX researchers, service designers, content strategists, creative technologists and DesignOps."
82,Staff UX Technologist,Baker Hughes,Remote in London W6,,We partner with Product and Engineering teams to create innovation that enhance and improves the customer experience.
83,Content Writer & Editor,Financial Times,London,,"Show flexibility: grow, develop and progress in a creative organisation.The successful candidate will focus on short-form content, covering new and evolving…"
84,newBusiness Analyst - e-commerce VP,"JPMorgan Chase Bank, N.A.",London,,We value creative innovators who are analytical thinkers with a bias for action that solves problems.The Small and Mid-Sized Business (SMB) and Business to…
85,Principal Consultant - Multiple Vacancies,TPXimpact,London SE1,,Work with others across the team and organisation to lift learning from delivery and help turn into creative and innovative ideas and new proposition for our…
86,newfrog - Senior Transformation Service Designer,Capgemini Invent,London,,Enough tech and digital know-how to hold a high-level conversation with a technologist.Frog partners with customer-centric enterprises to drive sustainable…
87,Senior Designer Menswear - Wovens/Tailoring,Q-HQ,London,,"Continually deliver a fresh, creative & commercial product range, taking accountability for all clothing categories.Have a strategic customer focus."
88,"Director, Head of Experience Design - Creative Shop Labs",Facebook App,London,,12+ years of experience design and/or creative direction experience.Portfolio of projects that demonstrate your skills as a creative director and experience…
89,Management Consultant - Digital Acceleration - Technical Pro...,Capgemini Invent,London,,"By combining strategy, technology, data science, and creative design expertise with an inventive mindset, we partner with our clients to innovate and transform…"
90,Design Strategy Lead,Visa,London,,"Work with a multi-disciplinary team of product owners, researchers, designers, and technologists to assess emerging global and regional commerce ecosystem…"
91,frog - Content & Marketing Solutions Expert,Capgemini Invent,London,,"Frog partners with customer-centric enterprises to drive sustainable growth, by building and orchestrating experiences at scale, while harnessing the power of…"
92,newUser Research Operations Manager,"JPMorgan Chase Bank, N.A.",London,,"DXD includes product designers, UX researchers, service designers, content strategists, creative technologists, and Design and Research Operations."
93,"User Experience Researcher, Associate","JPMorgan Chase Bank, N.A.",London,,"Our growing 200+ Digital Experience Design team (DXD) includes UX and visual designers, service designers, researchers and creative technologists spread across…"
94,newSenior Managing Consultant - Roads,Capgemini Invent,London,,"By combining strategy, technology, data science, and creative design expertise with an inventive mindset, we partner with our clients to innovate and transform…"
95,"Experience Design Manager, Creative Shop Labs",Facebook App,London,,"Continually seek new opportunities to unlock creative possibilities through your expertise.Collaborate with other internal and external creatives, disciplines…"
96,Mid-Senior Creative - Twitter Next UK - 9 month Fixed Term C...,Twitter,London,,You should also have experience crafting compelling story lines and insight-supported ideas to help build persuasive presentations.
97,Technology Strategy & Transformation Senior Manager,EY,London SE1,,"ET will also support our internal technology needs by focusing on a better user experience.Information Security (Info Sec) - Info Sec prevents, detects,…"
98,frog - Senior Motion Designer,Capgemini Invent,London,,"Ideate and execute cutting edge creative work within multi-disciplinary teams, to tell powerful stories that bring to life propositions and products for…"
99,Cloud Architect or Engineer,Deutsche Bank,London,,Accelerated promotion process for outstanding technologists.As an Engineer you will develop and deliver significant components of engineering solutions to…
100,Senior Consultant - Digital Fulfilment Operations (Retail/Co...,Capgemini Invent,London,,"First, and foremost, you will support and help to lead the design and delivery of transformative supply chain solutions for leading Consumer Products and Retail…"
101,Visual Designer / Presentation Designer,PSAV United Kingdom,Uxbridge UB8,,"Deliver World Class Service - Prioritise and manage multiple projects simultaneously, supporting, and collaborating with a cross-discipline team of creatives,…"
102,Customer Support Delivery Manager,EY,London SE1,,"Lead and deliver enablement, enhancement or intervention projects / programmes in support of EY’s Support Function.To qualify for the role, you must have."
103,Senior Consultant/Consultant - Supply Chain: Consumer Produc...,Capgemini Invent,London,,"First, and foremost, you will support and help to lead the design and delivery of transformative supply chain solutions for leading companies across a number of…"
104,"newSolutions Consultant, UK",Huma,Temporarily Remote in London,,Experience guiding external stakeholders through the solution design process and providing creative recommendations.Proven work experience in a related role.
105,Talent Partner,FundApps,Remote in London,,"Reporting to the People Operations Manager, you’ll support all sales, client services, operations and regulatory recruitment across FundApps, including sourcing…"
106,"newEvent Project Manager, Partner Events (1 year FTC)",Financial Times,London,,"This is a hands-on role that will require initiative and creative problem solving, and will be jointly accountable with the assigned Marketing Manager for…"
107,Senior Manager- Financial Risk & Regulatory,Capgemini Invent,London,,"By combining strategy, technology, data science, and creative design expertise with an inventive mindset, we partner with our clients to innovate and transform…"
108,Java / Scala Developer - OTC Derivatives,Morgan Stanley,London,,Institutional Securities Technology (IST) develops and oversees the overall technology strategy and technology solutions to drive and enable the Institutional…
109,Director - Consumer Products and Retail Distribution,Capgemini Invent,London,,"By combining strategy, technology, data science, and creative design expertise with an inventive mindset, we partner with our clients to innovate and transform…"
110,frog - Senior Growth Strategy Associate,Capgemini Invent,London,,"Frog partners with customer-centric enterprises to drive sustainable growth, by building and orchestrating experiences at scale, while harnessing the power of…"
111,Product Designer - Men's shirts. Maternity Cover,Q-HQ,London,,A highly creative commercial portfolio demonstrating your ability to present a concept following through to finished garment.Ability to travel is essential.
112,newLuxury Account Manager,Financial Times,London,,Take a considered but creative approach to answering briefs from clients and agencies.To achieve and exceed challenging revenue goals as well as agreed…
113,Energy Market Codes Expert,Capgemini Invent,London,,"By combining strategy, technology, data science, and creative design expertise with an inventive mindset, we partner with our clients to innovate and transform…"
114,Support Engineer,Keyless Technologies,Remote in London,,"Aptitude for creative problem solving.Keyless zero-knowledge biometrics solution eliminates the need to store and manage sensitive information, enabling…"
