,title,company,location,salary,summary
0,Web Designer,Saviom Software,"Bengaluru, Karnataka",,Hands-on design and development experience of product based websites.2 - 4 years of agency experience in designing and building product based websites.
1,Product Designer,Growth Bird,"Bengaluru, Karnataka",,"1+ years of design experience in a product company/design agency.Collaborate with the research, product, business, and engineering team to build scalable and…"
2,newProduct Designer,GSK,"Bengaluru, Karnataka",,Co-ordinating user research activities within the R&D customer base of this product area.Working closely with other Product Designers and the Product Owner and…
3,newProduct Designer,PayPal,"Bengaluru, Karnataka",,Our Product Designers influence teams to make customer-centric decisions across the product development lifecycle.
4,newUX Designer,Philips,"Bengaluru, Karnataka",,Explore and articulate options for service propositions beyond product propositions based on knowledge of customer context and product/service business…
5,Product Designer,RamSoft,"Remote in Bengaluru, Karnataka",,Create natural user experiences for all products and platforms.Ensure that industry best practices in product design are followed and continuously improved.
6,"Product Manager, Google Workspace Insights and Reporting",Google,"Bengaluru, Karnataka",,"Experience creating product roadmaps, building/shipping technical products, and working with cross-functional teams.Ability to make data-driven decisions."
7,Product Designer I,SmartShift Logistics Solutions,"Bengaluru, Karnataka",,Analogous charter with similar product line to spot demand but focused on driver-partnerinitiatives…End-to-end ownership of all platform products which ensure…
8,newUI Designer,Project Tinker,"Bengaluru, Karnataka",,Have a strong meme game.Have a sound understanding of Adobe Creative Suite and Figma.Think you can redesign every app on your phone better.
9,Product Designer III,Flipkart,"Bengaluru, Karnataka",,4 to 6 years of experience in product design or user experience design for mobile and/or desktop form factors.
10,newProduct Designer,Trinkerr Learning Technologies,"Bengaluru, Karnataka",,"Preferably at a growth stage consumer product startup.Work in agile product development (with co-founders, Product owners, Managers, Developers) to define…"
11,Graphics Designer (Remote),The Better India,"Remote in Bengaluru, Karnataka",,Collaborate with the brand team and understand the briefs given through research and discussion about the client’s objectives to produce designs for various…
12,newProduct Designer,Joveo,"Remote in Bengaluru, Karnataka",,Coming up with visual identities for various products.Owning the design for one of our flagship products.Redesigning our products through enhancing usability…
13,newProduct Designer - GoFood,GO-JEK,"Remote in Bengaluru, Karnataka",,"Mentor team of junior designers.Help define the roadmap, goals, and vision for the product.Collaborate and coordinate with Interaction designers, copywriters,…"
14,newProduct Designer,Jodo,"Bengaluru, Karnataka",,Discovery of online & offline educational products and services.Jodo is looking for a Product Designer to lead every aspect of product design in the…
15,newProduct Designer,Jodo,"Bengaluru, Karnataka",,Discovery of online & offline educational products and services.Jodo is looking for a Product Designer to lead every aspect of product design in the…
16,"Product Manager, Data Analytics",Google,"Bengaluru, Karnataka",,"4 years of experience in software product management.Drive product strategy and execution for performance, monitoring, and reliability."
17,Product Designer,Deliverr Inc,"Remote in Bengaluru, Karnataka",,"As an operator, you love and trust in the process of building and improving digital design with engineers, product owners, and designers."
18,newUX/UI Designer,Nbyula,"Domlur, Bengaluru, Karnataka","₹7,50,000 - ₹9,00,000 a year",Experience in creating illustrations that can add delight to the product experience.Experience in designing pixel-perfect mockups for digital products for both…
19,UX Designer,f1studioz,"Bengaluru, Karnataka","₹5,00,000 - ₹12,00,000 a year","You must have shipped a minimum of 2-4 products in the past, having core problem solving execution.UX Designers at f1 should combine innovation and technology…"
20,newGigNow - Product Designer,EY,"Bengaluru, Karnataka",,"Collaboration with other designers, product managers, developers and key stake holders to drive the end-user experience."
21,"Product Manager, Dataplex",Google,"Bengaluru, Karnataka",,Collaborate with teams and stakeholders in other product areas to produce cross-product integrations.5 years of experience in product management.
22,newUI/UX Designer,Siemens,"Bengaluru, Karnataka",,"Collaborating effectively with product, engineering, and management teams.Gather and evaluate user requirements in collaboration with product managers and…"
23,Product Designer,Soroco,"Bengaluru, Karnataka",,"As a Prouct designer, you will be responsible for understanding our users' needs and defining customer experiences that are cohesive with our apps across our…"
24,newProduct Manager,Apps10X Pvt Ltd,"Bengaluru, Karnataka","₹10,00,000 - ₹22,00,000 a year","Supervise and measure launched products and use data for product refinement.At least 1 year of experience as a product manager, ideally working on consumer…"
25,Product Designer,BeingUser,"Bengaluru, Karnataka",,"Partner with the team of designers, product managers and engineers throughout the design process - from creating user flows and wireframes to building user…"
26,Product Designer,Current Job Openings,"Bengaluru, Karnataka",,"Experience building and delivering strategic product experiences.As a product designer for Dunzo's user app, you will be designing a world class quick commerce…"
27,newUX Designer,Unikwan Innovations,"Bengaluru, Karnataka","₹7,00,000 a year",A part of the bandwidth would be required for mentoring junior designers and contributing to the process as a whole.UI/UX Design: 2 years (Preferred).
28,Visual Designer,CallHub,"Remote in Bengaluru, Karnataka","₹8,00,000 a year","Working with UX designers to develop and improve CallHub’s visual brand.Designing beautiful, informative product marketing pages for CallHub and partnering…"
29,Product Designer,Truecaller,"Bengaluru, Karnataka",,Make sure that the product is setting industry standards for excellence with innovative and beautifully clear designed products.
30,Product Designer (Remote),Nuclei,"Remote in Bengaluru, Karnataka",,Work with product managers to appropriately frame the right vision for the product.4 to 5 years of product design experience.
31,Lead / Senior Product Designer,BeingUser,"Bengaluru, Karnataka",,One who can coordinate research and build meaningful products based on insights.A day in the life of a Product Designer at Meesho will involve discussions and…
32,Product Designer / Senior Product Designer,Whatfix,"Bengaluru, Karnataka",,"Lead product design projects across the entire product lifecycle, and work with other designers, and cross-functional teammates to ship features in our end-user…"
33,newUI/UX Designer,Anmeda Systems Pvt Ltd.,"Bengaluru, Karnataka",,Responsible for developing new programs and proofing the program to develop needed changes to assure production of a quality product.
34,Product Designer,Dunzo,"Bengaluru, Karnataka",,"Experience building and delivering strategic product experiences.As a product designer for Dunzo’s user app, you will be designing a world class quick commerce…"
35,newUI/UX Designer,NOKIA,"Bengaluru, Karnataka",,"Advise, collaborate with and synthesize feedback from UX designers and researchers.NCOM is growing and is looking for a passionate User Interface Designer to…"
36,User Experience Interaction Designer,Google,"Bengaluru, Karnataka",,"Experience working collaboratively with other designers, product managers, and engineers.Guide product design decisions and outcomes to implement experiences,…"
37,Product Designer,Avataar,"Bengaluru, Karnataka",,"Preferably have experience working on e-commerce product description or brand pages.Deeply understand what drives customer purchase decisions, what companies…"
38,Product Designer,Rubrik Job Board,"Bengaluru, Karnataka",,"Partner with the team of designers, product managers and engineers throughout the design process - from creating user flows and wireframes to building user…"
39,Designer: User Experience Design,IBM,"Bengaluru, Karnataka",,"As an Associate Design Director, you lead a group of designers through a proposed solution phase.Define the overall product direction and user experience for…"
40,Graphic Designer,Global Shiksha India Pvt. Ltd.,"Bengaluru, Karnataka",,Total work: 5 years (Preferred).
41,Product Designer,Epifi Technologies,"Bengaluru, Karnataka",,"The product designer will work closely with other designers, user researchers, engineers and product managers throughout the design process—from creating user…"
42,User Experience Designer,Adobe,"Bengaluru, Karnataka",,"We are looking for a UX designer to help us craft new and improve existing workflows, improve the overall functionality of the product, and continuously iterate…"
43,Product Designer,Vahak,"Bengaluru, Karnataka",,"You will be working with designers, engineers and product managers to achieve these goals.Clearly communicate design logics, stories and concepts to cross…"
44,Product Designer,GoodWorker,"Bengaluru, Karnataka",,"Participate in the design ideation, planning and prioritization of our products and features.You will work closely with a talented and diverse group of…"
45,newAssociate Manager - Creative Designer,PhonePe,"Bengaluru, Karnataka",,"Using PhonePe, users can send and receive money, recharge mobile, DTH, data cards, pay at stores, make utility payments, buy gold, and make investments."
46,Brand Designer,PhonePe,"Bengaluru, Karnataka",,"You will proactively collaborate with the design, product & brand team and create assets, set guidelines, and bring to life visual content that seamlessly…"
47,Product Designer,Infifresh Foods,"Bengaluru, Karnataka",,Ability to ship products in a fast-paced environment.3+ years of relevant work experience in designing for B2C products.
48,Product Designer,Parallel,"Bengaluru, Karnataka",,You will be working on challenging and exciting projects along with a product-centric team using some of the best methods around product discovery & design.
49,Graphic Designer,Zotto Ltd,"Bengaluru, Karnataka","₹30,000 - ₹35,000 a month","Developing concepts, graphics and layouts for product illustrations, company logos and websites & marketing material.Job Types: Full-time, Regular / Permanent."
50,"Product Manager, Resource Management",Google,"Bengaluru, Karnataka",,"7 years of experience in product management.Experience creating product roadmaps from conception to launch, driving the product vision, defining go-to-market…"
51,newProduct Designer,Intuit,"Bengaluru, Karnataka",,"A passion for creating products that resonate on an emotional level.3+ years of experience in interaction design, product design, service design, or related…"
52,Product Designer,SignEasy,"Remote in Bengaluru, Karnataka",,Experience building products for mobile or web platforms.Collaborate with a team of designers via process planning and knowledge sharing.
53,"Product Manager, Next Billion Users, Ads",Google,"Bengaluru, Karnataka",,"4 years of experience in product management.Experience creating product roadmaps from conception to launch, driving the product vision, defining go-to-market…"
54,newSenior Product Designer - Gofood,GO-JEK,"Remote in Bengaluru, Karnataka",,"Mentor team of junior designers.Help define the roadmap, goals, and vision for the product.Collaborate and coordinate with Interaction designers, copywriters,…"
55,Product Designer,Captain Fresh,"Bengaluru, Karnataka",,Ability to ship products in a fast-paced environment.3+ years of relevant work experience in designing for B2C products.
56,newFashion Designer - Menswear [Fashion Tech Startup],HeSpoke Originals,"Bengaluru, Karnataka","₹18,000 - ₹20,000 a month","Research new trends, fabrics and techniques for product development.Drafting sketches and spec sheets for virtual development of the product."
57,newFreelance Interior Designer,DESIGN CAFE,"Bengaluru, Karnataka","₹1,50,000 a month",Be able to educate customers about the competitive advantages of the products of the company.DesignCafe is looking to hire Interior Designers with 2+ Year…
58,Lead Product Designer Full-Time,KhataBook,"Bengaluru, Karnataka",,"7+ years of experience in product design.Min 2+ years working for consumer product experiences.Along with the design leads, manage various design projects and…"
59,newSenior Product Designer,CredAvenue,"Bengaluru, Karnataka",,"Proactively launch efforts to improve different aspects of the product.Ensuring design quality, consistency, and coherence within the product."
60,newSenior Product Designer,CredAvenue,"Bengaluru, Karnataka",,"Proactively launch efforts to improve different aspects of the product.Ensuring design quality, consistency, and coherence within the product."
61,Senior Product Designer,BeingUser,"Bengaluru, Karnataka",,"Your product will be used by thousands.Champion user research within your product squad and leverage it to build consensus between business stakeholders, the…"
62,Junior UI/UX Designer,BlinkIn Technologies Pvt. Ltd.,"Remote in Bengaluru, Karnataka","₹2,00,000 a year","Create wireframes, screen flows and product prototypes.BlinkIn enables enterprises to create digital assistants for smart devices that guide people…"
63,Senior Product Designer - Technology & Digital,McKinsey & Company,"Bengaluru, Karnataka",,"Strong understanding of digital product lifecycle.Comfort working with designers, technical and business teams."
64,Product Designer,sybill,"Remote in Bengaluru, Karnataka",,"You will be handling interaction design and be collaborating with a cross-functional team of engineers, data scientists, product managers, and salespeople to…"
65,Lead Product Designer - UI,PhonePe,"Bengaluru, Karnataka",,"You will work closely with the lead experience designers and product managers, under the guidance to gather context and design the final UI based on wireframes…"
66,Lead Product Designer,Clumio,"Bengaluru, Karnataka",,"Be the gatekeeper of quality to build and release products that are impactful and delight customers.Partner closely with product management, documentation,…"
67,newLead Product Designer,Bikayi,"Bengaluru, Karnataka",,Hire designers who will take the team forward and mentor young designers to reach their full potential.Work with and align diverse stakeholders like product…
68,IFS - US LnD - Graphics Designer -rAssociate 2 - BLR,PwC,"Bengaluru, Karnataka",,"You’ll help us identify and source the best instructors, develop learning and performance improvement solutions across traditional and virtual classroom…"
69,UI/UX Designer,designandconstruct.in,"Bengaluru, Karnataka","₹30,000 a month","Gather and evaluate user requirements in collaboration with product managers and engineers.Illustrate design ideas using storyboards, process flows and…"
70,"Lead Product Manager, Next Billion Users, Google Assistant",Google,"Bengaluru, Karnataka",,"Develop product strategy, roadmap, and execution plans for the product line.Experience building and scaling a product.Experience working on mobile app/OS."
71,Senior Graphic Designer,Team Pumpkin,"Bengaluru, Karnataka","₹6,00,000 - ₹7,00,000 a year","Create a wide range of graphics & layouts for product illustrations, company logos & websites with software as photoshop.Test graphics across various media."
72,newProduct Manager,Reward360 Global Services,"Bengaluru, Karnataka","₹12,00,000 - ₹28,00,000 a year","Work with designers, engineers, marketing and partnerships to deliver products.Manage product lifecycle from ideation to launch and beyond."
73,Lead Product Designer,SmartShift Logistics Solutions,"Bengaluru, Karnataka",,"Collaborate with product management and engineering to define and implement innovative solutions for the product direction, visuals and experience."
74,Graphic Designer,Saviom Software,"Bengaluru, Karnataka","₹2,00,000 - ₹5,00,000 a year","Skilled in determining the message that the design should portray and developing graphics and visual images for product illustrations, logos, and websites."
75,Mechanical Designer,Praxien,"Remote in Bengaluru, Karnataka",,"Plastics Designer, Automotive experts, Shock Absorbers, Product Development, CATIA Analysis / Simulation, Heavy Frame Structure Design, Structural Anaysis, Weld…"
76,Senior User Experience Designer - McKinsey Digital,McKinsey & Company,"Bengaluru, Karnataka",,"Experience leading designers and other members of a cross-functional team.Holistic and human centered approach to product and service design, from research and…"
77,Senior Product Designer- UI,PhonePe,"Bengaluru, Karnataka",,"You will work closely with the lead experience designers and product managers, under the guidance to gather context and design the final UI based on wireframes…"
78,Product Designer,Zepto,"Bengaluru, Karnataka",,"2+ years of design experience in a product company.Collaborate with the research, product, business & engineering team to build scalable & impactful solutions."
79,Senior Product Designer,Tekion,"Bengaluru, Karnataka",,6+ years of experience with end-to-end product design.Obsession with users - who they are and how they use the product - to create the best experience for them…
80,"Product Manager, Google Pay Merchant",Google,"Bengaluru, Karnataka",,Synthesize requirements across multiple product stakeholders within the Payments product area.5 years of product management experience.
81,Lead - Creative Designer - Cleartrip,Flipkart,"Bengaluru, Karnataka",,Communicate business decisions and impact metrics with other designers/ teams.Helps fellow designers advocate for best practices by providing a strong voice…
82,"Sovereignty Product Manager, Compliance Experience, Google C...",Google,"Bengaluru, Karnataka",,"10 years of experience in product management.Experience creating product roadmaps from conception to launch, driving the product roadmap, defining go-to-market…"
83,UI-UX Designer - INTERN,Mantra Labs,"Bengaluru, Karnataka",,"If you also have a portfolio of design or case studies any problem-solving in any project that includes web/mobile applications, we’d like to meet you."
84,Senior Product Designer- Analytics,Whatfix,"Bengaluru, Karnataka",,"Lead product design across the entire product lifecycle, and work with other designers and cross-functional teammates to set strategy and ship product and…"
85,newUX Designer – Fresher,Bicsom,"Remote in Bengaluru, Karnataka",,"UX testing once the product is live.We expect you to have your domain knowledge of UX and UI, which includes, Information architecture, empathy map creation,…"
86,"Product Designer-III,Platform",Innovacer,"Bengaluru, Karnataka",,"Partner with product managers, developers, and designers to actively identify opportunities for improving the developer experience."
87,Opening for Engineering manager,Ergos Business Solutions,"Bengaluru, Karnataka",,"You will provide feedback to both designers and developers on technical feasibility, speed and optimization, and possible alternatives to difficult interactions…"
88,Senior Product Designer,Zepto,"Bengaluru, Karnataka",,"Has 5+ years of relevant experience in product design, preferably in a consumer facing product role with at least 2 year in leading designers."
89,newVisual Designer,IBM,"Bengaluru, Karnataka",,Work closely with user experience designers to create stunning visual designs.IBM Storage is looking for an experienced Visual Designer to work with a cross…
90,newVisual Designer,IBM,"Bengaluru, Karnataka",,Work closely with user experience designers to create stunning visual designs.IBM Storage is looking for an experienced Visual Designer to work with a cross…
91,Product Designer,cloudsek,"Remote in Bengaluru, Karnataka",,"Address product, marketing, and business needs.XVigil - Our SaaS-based product XVigil, helps clients assess security in real-time from the perspective of an…"
92,newSenior PCB Layout Designer,GETech Systems,"Bengaluru, Karnataka","₹20,00,000 a year","This innovative person will design and deliver high-quality PCB and test platforms to build hardware products involving satellite, cable and wireless consumer…"
93,Senior Product Designer,Gainsight,"Bengaluru, Karnataka",,"Gainsight is looking for passionate product designers with 3+ years of interaction design experience.Design solutions that meet product goals, requirements,…"
94,Product Specialist - Periscope,McKinsey & Company,"Bengaluru, Karnataka",,Deep experience in digital product development in B2C or B2B products.Experience delivering products throughout the product life cycle; knowledge of software…
95,Graphic Designer,The Wellness Shop,"Indiranagar, Bengaluru, Karnataka","₹8,00,000 a year","We provide products catering to cosmetics, wellness and healthcare segment.*.Minimum 3 years related professional experience as graphic designer.*."
96,Senior Product Designer,GSK,"Bengaluru, Karnataka",,Working across products and product families within R&D Operations.Interpreting and creating product design documentation.
97,UX Designer,Yara,"Bengaluru, Karnataka",,"Operate in cross-functional teams; including design, product, content, engineering and marketing in a collaborative effort to share and implement research and…"
98,newUX Designer (Remote),Foxmula Private Limited,"Remote in Bengaluru, Karnataka",,"Collaborative design with other partners viz. product management, marketing, technical architect, developers and visual designers."
99,Product Designer at Rubrik,BeingUser,"Bengaluru, Karnataka",,"Partner with the team of designers, product managers and engineers throughout the design process - from creating user flows and wireframes to building user…"
100,"Product Manager, Merchant Services, Google Pay",Google,"Bengaluru, Karnataka",,"Experience creating product roadmaps from conception to launch, managing product goals, defining go-to-market strategies, and leading design discussions."
101,Product Designer,Multirecruit,"Bengaluru, Karnataka","₹30,00,000 - ₹35,00,000 a year","Clearly communicate design logic, stories, and concepts to a cross-functional team of designers, engineers, analysts,s and product managers."
102,Lead Product Designer,Vahan,"Bengaluru, Karnataka",,Help shape the product strategy and vision.Experience helping lead and mentor a team of gifted designers.Collaborate with stakeholders to translate business…
103,Senior Product Designer,Transak,"Bengaluru, Karnataka",,"At least 6 years of design experience in a product company.Collaborate with the research, product, business and engineering teams to build scalable and…"
104,newUX Designer II,Microsoft,"Bengaluru, Karnataka",,"You’ll work in a focused team collaborating with fellow designer, content designers, interaction designers, visual and motion designers, qualitative researchers…"
105,Senior Analyst - Designer (Adobe + PPT),KPMG,"Bengaluru, Karnataka",,"The creative output is frequently high profile so the quality, accuracy and timeliness of the end product is of critical importance."
106,"Product Manager, Farmer Profile",Yara,"Bengaluru, Karnataka",,Delivered outcomes against a LoB/organizational strategy via digital products or product.Team and Talent Development: Builds and manages a team of product…
107,newSenior RTL Designer /uArch lead,Intel,"Hybrid remote in Bengaluru, Karnataka",,IP Engineering Group's (IPG) vision Build IPs that power Intel's leadership products and power our customer's silicon.Assist Pre-Silicon Verification team in.
108,Lead Product Designer,Tekion,"Bengaluru, Karnataka",,8 years of experience with end-to-end product design.Obsession with users - who they are and how they use the product - to create the best experience for them.
109,Lead Product Designer,MoEngage Inc,"Temporarily Remote in Bengaluru, Karnataka",,"Has 6+ years of relevant experience in product design.End-to-end ownership of one or more product lines.Communicate with users, researchers, product and tech…"
110,Senior Product Designer,Multiplier,"Remote in Bengaluru, Karnataka",,Minimum of 3 years of experience working as a product designer or a UX designer designing applications for web and mobile.
111,Product Designer (L3),Twilio,"Bengaluru, Karnataka",,"Has experience in designing complex systems that scale, operating models and consistent design tooling across matrixed teams designers, engineers, and product…"
112,Website Designer,Nextwebi,"Bengaluru, Karnataka",,"Create user centric designs, icons & product screens for an entire product.Be responsible for sourcing and deliver the best products in terms of designs or…"
113,SENIOR DESIGNER- SPORTSTYLE FOOTWEAR,PUMA,"Bengaluru, Karnataka",,"Contribute to the formulation of the annual product design plan for the product category and introduce and execute innovative design ideas, in order to achieve…"
114,Product Specialist – SharePoint and M365 - Hyderabad,Deloitte,"Bengaluru, Karnataka",,"Work with architecture, development and UI designers to design product features/solutions to meet the business requirements."
