,title,company,location,salary,summary
115,User Experience Designer,Siemens Healthcare Private Limited,"Bengaluru, Karnataka",,"You will mentor and lead junior designers by promoting sound design practices, educating and elevating the role of good design and its importance in the product…"
116,Head of Product Design,Epifi Technologies,"Bengaluru, Karnataka",,You have proven product design skills with solid experience about shipping consumer-facing high-quality products and have launched features/products to external…
117,Communications and Marketing Graphic Designer,Standard Chartered,"Bengaluru, Karnataka",,Strong consumer and product awareness.Promote and advertise our products and services through digital media and various internal communications channels.
118,Senior Product Designer- Enterprise,Whatfix,"Bengaluru, Karnataka",,"Lead product design projects across the entire product lifecycle, and work with other designers, and cross-functional teammates to ship product and features for…"
119,Mechanical Designer,Flexli Technologies Pvt Ltd,"Bengaluru, Karnataka",,"Creates documentation and specification for parts, assemblies, or finished products.In a very short span of time our products have gained trust of companies…"
120,Mechanical Designer,Flexli Technologies Pvt Ltd,"Bengaluru, Karnataka",,"Creates documentation and specification for parts, assemblies, or finished products.In a very short span of time our products have gained trust of companies…"
121,Product Designer,Cleartax,"Bengaluru, Karnataka",,"Bring our brand attributes to life throughout the product experience.Brainstorm product improvements with Product Managers (through need-finding, storytelling,…"
122,Graphic Designer,QNA International,"Bengaluru, Karnataka",,"Understanding of marketing, production, website design, corporate identity, product packaging, advertisements, and multimedia design."
123,"Product Manager, Apps Script",Google,"Bengaluru, Karnataka",,"Experience creating product roadmaps, building/shipping technical products, and working with cross-functional teams.Experience with low-code development."
124,Product Manager I,Flipkart,"Bengaluru, Karnataka",,2+ years of experience in product management in a top tier product company.Track record of shipping products and features with clean and solid consumer facing…
125,newSENIOR GAME DESIGNER,CoinFantasy,"Bengaluru, Karnataka",,"*Work on gameplay experiences ensuring critical and commercial success of the product*.*Design, balance and analyze new and existing features in the game…"
126,Furniture Designer,Design Cafe,"Bengaluru, Karnataka",,"To identify new solutions in the modular furniture.Scope includes all fixed furniture for a residence.Design, production drawings, production feasibility…"
127,Software Engineer,Intel,"Bengaluru, Karnataka",,"Determines computer user needs, advises hardware designers on machine characteristics that affect software systems such as storage capacity, processing speed,…"
128,Product Designer - Jira Platform,Atlassian,"Remote in Bengaluru, Karnataka",,"Facilitate workshops with designers, engineers, product managers, and customers for potential solutions to the identified problems in the most effective way."
129,UI/UX Designer,Pi Academy,"Remote in Bengaluru, Karnataka",,"Work Timings: *Saturday to Thursday (Friday day Off) 10 am to 7 pm (GMT, UK Time Zone).Conducting user research and testing."
130,newdesigner,The Kangaroo Project,"Bengaluru, Karnataka",,"Knowledge of suppliers, products, Indian and Australian Design codes, and the various skills to provide appropriate guidance from a documentation perspective."
131,Game Designer,GreedyGame Media Private Limited,"Bengaluru, Karnataka",,"As a Game Designer, you'll bring ideas, build prototypes, create interactive narration and develop the game's mechanics.UI/UX: 1 year (Preferred)."
132,Expert Designer - McKinsey Digital,McKinsey & Company,"Bengaluru, Karnataka",,"Our highly-skilled designers, digital engagement managers and agile developers deliver service concepts, experiential prototypes and go-to-market products to…"
133,User Experience Designer,Educational Initiatives,"Bengaluru, Karnataka",,Understand product specifications and current requirements.Keep abreast of competitor products and industry design trends.Strong portfolio of design projects.
134,UX Interaction Designer,Google,"Bengaluru, Karnataka",,"Deliver detailed design flows and specifications, ensure product excellence throughout product development and implementation process."
135,Sr. Graphic Designer,TargetG,"Bengaluru, Karnataka",,"Develop all required collaterals by understanding the product, purpose, channel and audience while aligning on the overall corporate and product brand…"
136,newUX/UI Designer,Gobillion,"Bengaluru, Karnataka",,Conduct user interviews before a new product design phase starts and after to gather customer.Feedback and be able to leverage user research to influence…
137,UX Designer,Tids AR Studio,"Remote in Bengaluru, Karnataka",,"Collaborative design with other partners viz. product management, marketing, technical architect, developers, and visual designers."
138,"Manager, Network Operations",Google,"Bengaluru, Karnataka",,"Partner with leadership across various disciplines and act as a point of contact for stakeholders, planners, designers, and operational business partners."
139,newProduct Architect,Wipro Limited,"Bengaluru, Karnataka",,Define product requirements and design needs by displayingcomplete understanding of product vision and business requirements.Holmes engineering and roll out.
140,Product Designer,nurture.farm,"Bengaluru, Karnataka",,Collaborating with stakeholders to translate business goals into unique product experiences.Nurture.farm is looking for clear first-principles thinkers and…
141,UI Designer,Econote Technology Private Limited,"Bengaluru, Karnataka",,Provide insights and incorporate the feedback into the product design.We are looking for a designer who is technically sound and approaches every problem with…
142,Creative Designer,Engagedly Labs,"Bengaluru, Karnataka",,"Built using advanced technology, Engagedly’s product provides its clients with enriching solutions on their workforce engagement needs."
143,newDesigner: Service Design,IBM,"Bengaluru, Karnataka",,"Gathering and evaluating user requirements, in collaboration with product managers and engineers to deliver intuitive and human-centred solutions."
144,Associate Product Manager,Vahan,"Bengaluru, Karnataka",,1+ years of product management experience.Prior experience building an Internet marketplace product.In this role you will collaborate closely with salespeople…
145,newVisual Designer,ZS Associates,"Bengaluru, Karnataka",,The graphic designer produces large volumes of work and is responsible for/dependent on effective teamwork and communication.Min Three years of experience in.
146,Product Designer,CognitiveClouds,"Bengaluru, Karnataka",,Identify KPIs for products (and drive consensus with stakeholders).You have proven experience with native mobile/tablet product design.
147,Product Manager,GO-JEK,"Bengaluru, Karnataka",,"Drive ideation, product strategy and execution for your product division, partnering with your product development team and cross-functional stakeholders."
148,Associate Product Manager,Edureka,"Bengaluru, Karnataka",,Build short-term and long-term product roadmap and.We are looking for individuals with 1-4 years of Product Management experience in Consumer Internet or SaaS…
149,Graphic Designer,Akriveia Technologies Pvt Ltd,"Bengaluru, Karnataka",,"Create images that identify a product or convey a message.Develop graphics for product illustrations, logos, and websites.Total work: 1 year (Preferred)."
