,title,company,location,salary,summary
0,newData Science Researcher,Shell,"Bengaluru, Karnataka",,"As Data Science Researcher, you will work hands-on across project teams focusing on research and implementation of Data Science models on different Shell Assets…"
1,newAI Engineer,Intel,"Hybrid remote in Bengaluru, Karnataka",,"Building high-performance Machine Learning applications.Building simulation solutions (platforms, and related infrastructure)."
2,newSystems Modelling Researcher,Shell,"Bengaluru, Karnataka",,Systems Modelling capability is a key enabler in multiscale modelling in computational science and responsible for providing critical input towards design and…
3,"Machine Learning Intern, Core ML",Skit.ai,"Temporarily Remote in Bengaluru, Karnataka",,"Its suite of speech and language solutions enable enterprises to automate their contact centre operations.Design, build and evaluate Machine Learning systems."
4,Student Intern – Access™,Altair Engineering,"Bengaluru, Karnataka",,"Access provides a simple, powerful, and consistent interface for submitting and monitoring jobs on remote clusters, clouds, and other resources, allowing…"
5,newSIEM - Admin,IBM,"Bengaluru, Karnataka",,Responsible for security researcher to provide insight and understanding of new and existing information security threats.
6,newUX Researcher,BeingUser,"Bengaluru, Karnataka",,"User Research, Usability testing, Product and Design Research.Glance is the world’s first screen zero platform, enabling consumers to experience the best of…"
7,newUX Researcher,Mantra Labs,"Bengaluru, Karnataka",,"Ideally, the candidate should have a minimum of a 6-year of experience in UX research and analysis of consumer-facing products."
8,Applied Machine Learning Researcher,Microsoft,"Bengaluru, Karnataka",,MCDS Research is a shared service within MCDS that drives impact and innovation using state-of-the-art Machine Learning (ML) and strives to push the boundaries…
9,Machine Learning Researcher,Skit.ai,"Temporarily Remote in Bengaluru, Karnataka",,"Along the way, you get to publish in prestigious ML conferences and work with a strong community of researchers from the field."
10,newResearcher High Performance Computing,Shell,"Bengaluru, Karnataka",,Shell is currently assembling a technical team of extremely talented and passionate computational scientists to realize the company’s full digital potential.
11,AI Academic Liaison and Research Evangelist,MathWorks,"Hybrid remote in Bengaluru, Karnataka",,"Engage with professors, researchers, and industry to advance the use of MATLAB for AI applications.You will draw on your technical and academia expertise, to…"
12,newSIOC: Security and Privacy consultant,IBM,"Bengaluru, Karnataka",,Collaborate with other cyber threat researchers based on subject matter expertise.Prior experience working as a cyber threat researcher or analyst.
13,Security Researcher,Siemens Technology and Services Private Limited,"Bengaluru, Karnataka",,"You will conduct research that will yield new insights, theories, analysis, data, algorithms, and help secure the systems and software."
14,Research Specialist,Accenture,"Bengaluru, Karnataka",,Develops structured research insights beyond the data.Is involved in writing articles / reports and/or preparation of client events/meetings.
15,Data Scientist,Microsoft,"Bengaluru, Karnataka",,"Excellent communication skills and the ability to collaborate in a multi-disciplinary team consisting of Service Engineers, Software Engineers, Program Managers…"
16,Research Associate Manager,Accenture,"Bengaluru, Karnataka",,Mentors more junior researchers and demonstrates ability to lead and support small project research teams.Manages projects and complex analysis independently.
17,DX/UX Researcher,Intel,"Bengaluru, Karnataka",,"The DX Researcher will be responsible for designing and executing research to identify software developer workflows, pinpoint opportunities to fulfil unmet…"
18,"Pre-Doctoral Researcher, University Graduate (Fixed-Term Con...",Google,"Bengaluru, Karnataka",,"As a Pre-Doctoral Researcher, you will collaborate with researchers, scientists and engineers at Google Research working on fundamental research and applied…"
19,Deep Learning Engineers - INTERNSHIP,Conxai Technologies GmbH,"Bengaluru, Karnataka",,"We are building the first NO-CODE AI PLATFORM for the construction industry, with the 3rd generation Explainable AI, that allows users to create complex use…"
20,newApplication Developer: Mobile,IBM,"Bengaluru, Karnataka",,"Collaborate with researchers, engineers and product managers throughout design process - from creating research protocols, personas, scenarios, information…"
21,Research Scientist,IBM,"Bengaluru, Karnataka",,"As a research scientist in the area of intelligent business process automation, you will explore problems related to Enterprise AI technologies for process…"
22,newDirector - Innovation and Design,WELLS FARGO BANK,"Bengaluru, Karnataka",,"Collaborates with researchers in academia to make bank ready for the future.Involve in idea management, rapid prototyping, startup partnership and other…"
23,newUser Researcher,IBM,"Bengaluru, Karnataka",,"Software Developers at IBM are the backbone of our strategic initiatives to design, code, test, and provide industry-leading solutions that make the world run…"
24,Developer Experience Researcher,Intel,"Bengaluru, Karnataka",,You must be hands-on and have the needed mix of UX skills and leadership qualities to enroll your technical colleagues in pursuing developer experience…
25,Data Scientist - AI Developer,SAP,"Bengaluru, Karnataka",,"By exploring unconventional ideas and developing inspiring proofs of concept, we push the state of the art in computer science and its applied fields to provide…"
26,AI Frameworks Validation Engineer,Intel,"Hybrid remote in Bengaluru, Karnataka",,"Optimizes code for various computing hardware backends, and interacts with machine learning and/or deep learning researchers, and utilizing experience with…"
27,Associate Analyst,Vectra,"Bengaluru, Karnataka",,Vectra's threat detections are powered by a deep understanding of attacker methods and problem-optimized AI algorithms.Open source development a plus.
28,Malware Researcher,cloudsek,"Remote in Bengaluru, Karnataka",,"XVigil - Our SaaS-based product XVigil, helps clients assess security in real-time from the perspective of an attacker, 24 hours a day, seven days a week."
29,Lead/Principle Machine Learning Engineer & Researcher,Square Root Consulting,"Bengaluru, Karnataka",,"As a Data Scientist & ML Engineer you will have the responsibility of creating and leveraging the state-of-the-art algorithms in machine learning, deep learning…"
30,Design Researcher,IBM,"Bengaluru, Karnataka",,Visualization is critical to discovering data-driven insights and effectively communicating that knowledge to others.Participate in the IBM Design Chapter.
31,Research Engineer,IBM,"Bengaluru, Karnataka",,"Software Developers at IBM are the backbone of our strategic initiatives to design, code, test, and provide industry-leading solutions that make the world run…"
32,Applied ML engineer,sybill,"Bengaluru, Karnataka",,"3+ years of experience as an ML engineer, data scientist, CV/NLP researcher, or in a related role.Sybill joins your calls with you and provides insights into…"
33,Research Software Engineer,IBM,"Bengaluru, Karnataka",,"Software Developers at IBM are the backbone of our strategic initiatives to design, code, test, and provide industry-leading solutions that make the world run…"
34,VoIP Engineer,Skit.ai,"Bengaluru, Karnataka",,"Diagnose, troubleshoot, resolve quality issues related to VoIP and telephony platforms and applications.Collaborate with the team to contribute on design and…"
35,Artificial Intelligence Researcher - Freshers,BigSpire Software,"Bengaluru, Karnataka",,"Skill Sets: Should have a good communication skills, knowledge in AI concepts and analytical skills Qualifications: Bachelor or Masters degree in Business…"
36,AI Data Foundation Research Engineer,Hewlett Packard Enterprise,"Bengaluru, Karnataka",,"We expect all our researchers to provide thought leadership and technical influence both internally and externally to HPE, as well as take innovative ideas and…"
37,Senior Threat Intelligence Analyst,ZeroFOX,"Bengaluru, Karnataka",,"Using our proprietary hybrid intelligence platform, we focus on analyzing the world of threat intelligence & vulnerabilities and providing detailed analysis and…"
38,AI/ML Specialist / Architect,Bosch Group,"Bengaluru, Karnataka",,Consumer Goods and Building Technology.The expectation is for the identified candidate to lead a group of AI/ML resources to bring the right fit methodologies…
39,Junior open source compiler developer,IBM,"Bengaluru, Karnataka",,"Software Developers at IBM are the backbone of our strategic initiatives to design, code, test, and provide industry-leading solutions that make the world run…"
40,Research Scientist - Image Analytics,GE Corporate,"Bengaluru, Karnataka",,"As a group, we Innovate and execute on the R&D strategy around image analytics aligned our healthcare and industrial businesses in a broad set of areas…"
41,SCAI Centre Fellow,Microsoft,"Bengaluru, Karnataka",,"Candidates must also be able to collaborate effectively with other researchers, product development teams and external collaborators."
42,Research Manager - NLP & Machine Learning,Uniphore,"Bengaluru, Karnataka",,Experience managing a team of researchers spanning both applied and pure research.Manage a growing team of engineers and researchers focused on speech…
43,newSenior NLP Data Scientist,Shell,"Bengaluru, Karnataka",,"Our team develops the advanced products and technologies Shell needs to meet customer demand.As a Senior NLP Data Scientist, you will sit across project teams…"
44,Technical Specialist - GAP,Altair Engineering,"Bengaluru, Karnataka",,"Conduct training sessions / webinars and be a trusted advisor for universities worldwide, top notch researchers and student teams in competitions about Altair…"
45,"Specialist, Data Science and IoT",Altair Engineering,"Bengaluru, Karnataka",,"Conduct training sessions / webinars and be a trusted advisor for universities worldwide, top notch researchers and student teams in competitions about Altair…"
46,Client Technology - Senior Experience Researcher,EY,"Bengaluru, Karnataka",,"Owns the delivery of experience research activities to advise the user experience within a sophisticated client or internal project, presenting to and…"
47,Software Engineer II,Microsoft,"Bengaluru, Karnataka",,We are looking for an engineer with a passion to improve the state of the art.The work involves solving low-level systems problems such as GPU state and memory…
48,MBOS_Data Science Engineer - Image Database,Mercedes-Benz Research and Development India...,"Bengaluru, Karnataka",,"Assemble large, complex data sets that are analysis/training ready for the machine learning engineers/researchers.B.E. / B. Tech in Computer Science."
49,newAnalyst-Product Development,Amex,"Bengaluru, Karnataka",,Amex AI Labs is currently co-located in Bangalore and New York and involves dynamic and talented product managers and researchers having research and product…
50,newStaff Engineer - Backend (Atlas),ThoughtSpot,"Bengaluru, Karnataka",,"Work with diverse, cross-functional teams of designers, UX researchers, engineers, product managers in a fast, collaborative process."
51,Enterprise Data Science Engineer,Lam Research,"Bengaluru, Karnataka",,"Work with machine learning engineers, researchers to accelerate AI/ML development for Industry 4.0 use-case deployment."
52,Research Senior Analyst,Accenture,"Bengaluru, Karnataka",,"Together, we will continue to create business impact through the unique combination of Client & Market vision, AI outputs and storytelling deliverables."
53,Application Developer: Mobile Android,IBM,"Bengaluru, Karnataka",,"Collaborate with researchers, engineers and product managers throughout design process - from creating research protocols, personas, scenarios, information…"
54,Full Stack Engineer,Balbix,"Bengaluru, Karnataka",,"You will collaborate closely with our data scientists, threat researchers and network experts to solve real-world problems plaguing cybersecurity."
55,"Senior Machine Learning Researcher, Speech",Skit.ai,"Temporarily Remote in Bengaluru, Karnataka",,Its suite of speech and language solutions enable enterprises to automate their contact centre operations.Lead enquiry in the research directions and come up…
56,Head of UI/UX Design,Wells Fargo,"Bengaluru, Karnataka",,"Directly managing a team of interaction designers, visual designers, content strategists/editors, UX researchers and design delivery producers."
57,Research Manager - Automatic Speech Recognition,Uniphore,"Bengaluru, Karnataka",,Experience managing a team of researchers spanning both applied and pure research.Manage a growing team of engineers and researchers focused on speech…
58,"Senior Software Engineer, Compilers, Machine Learning Accele...",Google,"Bengaluru, Karnataka",,Collaborate with machine learning researchers to guide compiler development for future ML trends.Bachelor’s degree or equivalent practical experience.
59,Senior Network Automation Researcher & Standardization Speci...,NOKIA,"Bengaluru, Karnataka",,Nokia Standards is responsible for research and standardization activities related to 5G and 6G cellular networks and collaboration with internal and external…
60,newXFR,IBM,"Bengaluru, Karnataka",,Responsible for security researcher to provide insight and understanding of new and existing information security threats.
61,newSenior User Experience Designer,Adobe,"Bengaluru, Karnataka",,"We are designing next-generation experiences for a wide range of creatives - from illustrators to animators to brand designers and many more, empowering them in…"
62,newStaff Data Engineer,Babylon,"Bengaluru, Karnataka",,"Act as a spokesperson for software design best practices and will advise on designing, performance/scalability tuning of batch and real time stream analytics…"
63,newBCAI - Senior Data Scientist,Bosch Group,"Bengaluru, Karnataka",,"Some of the areas of research include software intensive systems, artificial intelligence, robotics, computer vision, human computer interaction, energy,…"
64,newQuality Specialist - API Automation Framework,SAP,"Bengaluru, Karnataka",,"You will work together with a team of dedicated experts including researchers, business developers, developers, data scientist and dev ops engineers with the…"
65,Senior NLP Scientist,Uniphore,"Bengaluru, Karnataka",,"3 + years of hands-on experience developing production grade NLP systems using open source technologies.Hands-on experience with NER/L, information extraction,…"
66,"Senior Machine Learning Researcher, NLU",Skit.ai,"Temporarily Remote in Bengaluru, Karnataka",,Its suite of speech and language solutions enable enterprises to automate their contact centre operations.Lead enquiry in the research directions and come up…
67,Research Scientist - Machine Learning / Research Scientist -...,GE Corporate,"Bengaluru, Karnataka",,"We innovate and execute Analytics technologies that combine domain knowledge with advanced operations research, machine learning and text mining algorithms to…"
68,Member of Technical Staff - Frontend (MTS-3),ThoughtSpot,"Bengaluru, Karnataka",,"Work with diverse, cross-functional teams of designers, UX researchers, engineers, product managers in a fast, collaborative process."
69,newSIEM IR,IBM,"Bengaluru, Karnataka",,Responsible for security researcher to provide insight and understanding of new and existing information security threats.
70,Senior Designer,Microsoft,"Bengaluru, Karnataka",,"In this role, you’ll design experiences for customer support agents, their managers, and their customers that solve complex interactions with elegance and…"
71,Software Engineering - Ph.D (Graduating Class of 2021/2022),Salesforce,"Bengaluru, Karnataka",,"We are looking for applied researchers with solid computer science fundamentals, mathematical modeling, and distributed systems background to work in a team…"
72,Machine Learning Research Engineer,Skit.ai,"Temporarily Remote in Bengaluru, Karnataka",,"Its suite of speech and language solutions enable enterprises to automate their contact centre operations.Design, build and evaluate Machine Learning systems."
73,Senior Engineer - Model Based Controls,GE Corporate,"Bengaluru, Karnataka",,"We are looking for highly motivated people with proven track record to conduct research in control system design, real time optimization, first principles…"
74,Director - User Experience Design,Adobe,"Bengaluru, Karnataka",,"You will lead a group of passionate and hard-working designers and managers who craft experiences across web, mobile, and desktop applications while using AI/ML…"
75,DigitalBCG | Platinion Engineer,Boston Consulting Group,"Bengaluru, Karnataka",,"Collaborating: You have the ability and enthusiasm to work with researchers, engineers, business consultants, and other designers who will all challenge and…"
76,Backend Developer,Expertia Incorporation,"Bengaluru, Karnataka",,You will work in a varied team of developers and will be involved in the entire development lifecycle.Experience with Python - Flask/DJango framework or NodeJS…
77,Head - Advanced development,Cerentral Consultants,"Bengaluru, Karnataka",," Led a team of researchers for 1+ years. Take inputs from current technology trends, key customer sites and closely work with the."
78,"Analyst / Senior Analyst - Risk & Information Management, Da...",Amex,"Bengaluru, Karnataka",,"Depending on role and business needs, colleagues will either work onsite, in a hybrid model (combination of in-office and virtual days) or fully virtually."
79,Technical Content Developer 3,Dell Technologies,"Bengaluru, Karnataka",,"Collaborate with designers, researchers, product managers, and engineers to manage and deliver content.Ground-breaking products deserve to be accompanied by…"
80,Senior Cyber Security Engineer,Automation Anywhere,"Bengaluru, Karnataka",,"Create ,Manage and Coordinate VDP ( Vulnerability Disclosure Program) and interfacing with other cross functional team, vendor and security researchers."
81,#2696-Test Engineer AI related Healthcare Solutions,Qualitest,"Bengaluru, Karnataka",,Align with product owner and stakeholders to derive meaningful test scenarios and create test cases.Automate test cases and setup / maintain automated test…
82,Lead Product Designer,MoEngage Inc,"Temporarily Remote in Bengaluru, Karnataka",,"Communicate with users, researchers, product and tech teams to ensure everyone understands what is needed.Somebody who can empathize with the customer through…"
83,Senior Member of Technical Staff - Mobile,ThoughtSpot,"Bengaluru, Karnataka",,"Work with diverse, cross-functional teams of designers, UX researchers, engineers, product managers in a fast, collaborative process."
84,Lead Product Designer,Tekion,"Bengaluru, Karnataka",,"You'll take on complex tasks and transform them into intuitive, accessible, and easy-to-use designs — from the first-time user to the sophisticated expert."
85,newSenior Staff Engineer - Data Modelling,ThoughtSpot,"Bengaluru, Karnataka",,"Work with diverse, cross-functional teams of designers, UX researchers, engineers, product managers in a fast, collaborative process."
86,Deep Learning Engineers,Conxai Technologies GmbH,"Bengaluru, Karnataka","₹18,00,000 - ₹27,00,000 a year","We are building the first NO-CODE AI PLATFORM for the AEC industry, with the 3rd generation AI, that allows users to create complex use cases with zero coding…"
87,Associate Manager - Data Engineer,Sutherland,"Bengaluru, Karnataka",,"Work on cutting edge technology, with frequent interactions with world’s leading researchers and own/run a high visibility program of Sutherland."
88,"Lead Machine Learning Research Engineer, NLU",Skit.ai,"Temporarily Remote in Bengaluru, Karnataka",,Its suite of speech and language solutions enable enterprises to automate their contact centre operations.We are looking for ML Engineer the field of Natural…
89,Director of Consumer Insight,Entropik Tech,"Bengaluru, Karnataka",,Lead a team of researchers & data analysts to manage projects and deliver meaning Insights for Client engagements.
90,Senior Software Engineer,Microsoft,"Bengaluru, Karnataka",,The Azure Machine Learning Training team is seeking experienced developers with distributed systems experience.Experimentation and model tracking using MLFlow.
91,Architecture Research Scientist,Intel,"Bengaluru, Karnataka",,The Processor Architecture Research (PAR) Lab at Intel Labs leads corporate-wide research into futuristic processor architectures.
92,Senior Product Manager,Expertia Incorporation,"Bengaluru, Karnataka",,Experience Required: 4 to 6 years of experience.You will also work cross-functionally to complete product roadmaps and discover new opportunities.
93,Staff Software Architect,GE Healthcare,"Bengaluru, Karnataka",,Ability to quickly build prototypes working with Data scientists & researchers to demo the same at trade-shows & leadership.AWS Certification is a plus.
94,Growth and Business Development Manager,KYC Hub,"Bengaluru, Karnataka",,"Our products help firms to mitigate the risk of fraud and financial crime using AI and automation.We are a SaaS platform for global customer onboarding,…"
95,Principal Program Manager,Microsoft,"Bengaluru, Karnataka",,The Microsoft Turing team is an innovative research and engineering team working on state-of-the-art deep learning models to power end user experiences across…
96,Senior System Software Engineer,NVIDIA,"Bengaluru, Karnataka",,"Design, develop and maintenance of pre-silicon simulation platforms.Perform software bring up on hardware simulation platform."
97,Principal Engineer - Falcon,ThoughtSpot,"Bengaluru, Karnataka",,"Work with diverse, cross-functional teams of designers, UX researchers, engineers, product managers in a fast, collaborative process."
98,UX Interaction Designer,Algonomy,"Remote in Bengaluru, Karnataka",,"Collaborate with a team of designers, researchers, engineers, and product managers.Algonomy products are used by marketers, digital optimization or…"
99,"Lead Machine Learning Research Engineer, Speech",Skit.ai,"Temporarily Remote in Bengaluru, Karnataka",,Its suite of speech and language solutions enable enterprises to automate their contact centre operations.We are looking for ML Engineer the field of Speech…
100,Senior Full Stack Developer,Expertia Incorporation,"Bengaluru, Karnataka",,"Experience Required: 4 to 6 years of experience.As a Full Stack Developer, you will have a key role in our development of new and existing products."
101,Technical Expert: Deep Learning & Collective Intelligence,Siemens Technology and Services Private Limited,"Bengaluru, Karnataka",,"We are central research and development unit, Corporate Technology (CT) are a strategic partner to Siemens’ operative units and provide important services along…"
102,Senior Product Designer,Tekion,"Bengaluru, Karnataka",,"You'll take on complex tasks and transform them into intuitive, accessible, and easy-to-use designs — from the first-time user to the sophisticated expert."
103,UX Manager,Zycus,"Bengaluru, Karnataka",,"Experience leading, mentoring and managing/developing a team of UI/UX designers and researchers.This role includes all the critical aspects of UX function -…"
104,Technical Project Manager,Exigent Group Limited,"Bengaluru, Karnataka",,"Develop and maintain partnerships with outside resources—including third-party vendors and researchers.As an ideal candidate, you have proven experience in a…"
105,Application Developer: Mobile iOS,IBM,"Bengaluru, Karnataka",,"Collaborate with researchers, engineers and product managers throughout design process - from creating research protocols, personas, scenarios, information…"
106,Design Lead - Samya.ai,Fractal.ai,"Bengaluru, Karnataka",,"Samya is a term that means ""bringing things to equilibrium"".Our team combines strengths from various disciplines, including Product Development, R&D, AI/ML,…"
107,DigitalBCG | Platinion Principal Engineer,Boston Consulting Group,"Bengaluru, Karnataka",,"Collaborating: You have the ability and enthusiasm to work with researchers, engineers, business consultants, and other designers who will all challenge and…"
108,Senior Systems Specialist-Controls Engineering,Cytiva,"Bengaluru, Karnataka",,"As a member of a multidisciplinary project team, the Senior Systems Specialist will lead the design, development, programming, verification, and delivery of…"
109,Senior Staff Software Architect,GE Corporate,"Bengaluru, Karnataka",,Working on digital solutions along with other researchers and product teams of businesses.We are looking to grow our team of Software researchers who dabble…
110,Product Design Lead,Zycus,"Bengaluru, Karnataka","₹30,00,000 - ₹40,00,000 a year","Experience leading, mentoring and managing/developing a team of UI/UX designers and researchers.This role includes all the critical aspects of UX function -…"
111,Senior Product Designer,MoEngage Inc,"Temporarily Remote in Bengaluru, Karnataka",,"Communicate with users, researchers, product and tech teams to ensure everyone understands what is needed.Somebody who can empathize with the customer through…"
