,title,company,location,salary,summary
0,AI Researcher - London,"JPMorgan Chase Bank, N.A.",London,,You will work on multiple research projects in collaboration with internal and external researchers and with applied engineering teams.
1,Full Time Opportunities - AI Researcher,Microsoft,Cambridge,,"Using a combination of high-throughput sequencing data, functional assays and state-of-the-art machine learning methods at scale, we are learning to decode the…"
2,Clinical Researcher,Behold.ai,London,,Location: London We are seeking a Clinical Researcher to join our organisation to work alongside our Clinical Research Lead to deliver ground-breaking…
3,"Associate Software Engineer, Explainable AI (XAI)","JPMorgan Chase Bank, N.A.",London,,"Provide real-time visualizations for analysis by traders, researchers and risk managers.Great interpersonal skills and able to interface with data scientists,…"
4,newAI Researcher - DRL for Power Markets,Shell,London,,We have an exciting position for an AI Researcher to join the Deep Reinforcement Learning (Deep RL) group which forms part of the GM-ship of Artificial…
5,Explainable AI Researcher - London XAI Centre of Excellence...,"JPMorgan Chase Bank, N.A.",London,,You will work on multiple research projects in collaboration with internal and external researchers and with applied engineering teams.
6,AI/ML Fellowship,GSK,London,,"In addition, the researcher will learn about the pharmaceutical industry and software engineering, and translate their research into tools that aid discovery…"
7,Social Media Researcher,Meltwater,London,,"As a Social Media Researcher, you will work at the cross line between Client Directors and Research Managers at Linkfluence."
8,newJunior UX Researcher,Sentieo,Remote in London,,Our Design & Insights team drives the experience vision to make Sentieo the most intuitive and attractive financial research platform on the market.
9,NLP Algorithm Researcher,BeyondMinds,London,,"M.Sc. degree in Computer Science, Engineering, Data Science, Bioinformatics, or a related discipline.Understanding of both classic and modern NLP techniques,…"
10,"Postdoctoral Researcher (AI), PhD University Graduate",Facebook App,London,,"Facebook is seeking a Postdoctoral Researcher to join Facebook AI Research (FAIR), a research organization focused on making significant progress in AI."
11,ESG Researcher,Richmond Global Sciences (RGS),London,,The successful candidate will research the social and environmental impacts of products in specific industries and design assessment frameworks to derive…
12,"Technical Program Manager, AI",Facebook App,London,,Experience working with external researchers and research institutions.Facebook is seeking a Technical Program Manager (TPM) with research/research-to…
13,newMachine Learning Researcher,Microsoft,Cambridge,,Undertake cutting-edge machine learning research to drive better human-in-the-loop systems.Write research code to test new approaches or develop novel…
14,AI Researcher (Fairness) - Executive Director / Vice Preside...,"JPMorgan Chase Bank, N.A.",London,,They pursue primary research in areas related to our research pillars as well as concrete problems related to financial services.
15,AI Specialist - Research Scientist,Meta,London,,"Experience holding a faculty, industry, or government researcher position.Individuals in this role are expected to be recognized experts in identified research…"
16,newAI Engineer,Graphcore,Remote in London+1 location,,Develop strong technical relationships with researchers and engineers at our customers and partners and help them to develop new algorithms and achieve…
17,"Full Time Opportunities, Cambridge Residency: Post-Doc Resea...",Microsoft,Cambridge,,The Alexandria team in Microsoft Research Cambridge (UK) invites machine learning and AI researchers with a focus on knowledge discovery to join our two-year…
18,Publicly Available Information Associate Researcher (Intelli...,Huntington Ingalls Industries Inc.,Mildenhall IP28,,Synthesize large data sets to inform senior researchers and staff on the potential design of complex analyses.Advanced working knowledge of geo-enabled PAI.
19,Experienced Quantitative Researcher,BNP Paribas,London,,"The Global Markets Quantitative Research division is in charge of the modelling, pricing & risk management developments for the entire offering of products…"
20,Machine Learning Researcher/Engineer,Samsung Electronics,Hybrid remote in Staines-upon-Thames,,This position will require you to work closely with researchers and engineers to enable and accelerate new research efforts for personalised ML.
21,Quantitative ESG Researcher,Richmond Global Sciences (RGS),London,,"The successful applicant will combine exceptional analytical and quantitative skills and work at the heart of our operations, developing and improving our…"
22,Senior Vulnerability Researcher,Raytheon Intelligence & Space,Gloucester GL4,,"The team includes post-doctorate researchers, experienced data scientists and engineers with customer knowledge, security research and machine learning…"
23,AI-Quant - Intermediate,Crypton Partner Management,London W1D,,"Experienced in managing a team of quantitative researchers, laying out a vision and giving useful feedback and constructive supervision on the team's work."
24,Associate Data Scientist,Hitachi Europe Ltd.,Hybrid remote in London,,"The role is aimed at graduates, or final year undergraduates, with a first degree in a STEM related subject who wish to develop a career in data science and…"
25,Machine Learning Researcher/Engineer – Personalised ML (open...,Samsung Electronics,Hybrid remote in Staines-upon-Thames,,This position will require you to work closely with researchers and engineers to enable and accelerate new research efforts for personalised ML.
26,AI Engineer - KTP Associate,University of Bath,Bath,"£50,000 a year",This project will develop a suite of real time AI decision services designed to enable local authorities to better understand and control their regional…
27,Senior Knowledge Graph Researcher,Samsung Electronics,Hybrid remote in Staines-upon-Thames,,"We need enthusiastic researchers with a strong academic background and experience in Ontologies, Knowledge Representation and Data Management."
28,newClient Technology - Experience Researchers,EY,London SE1,,"Owns the delivery of User Experience research activities to inform digital products and the user experience across projects, presenting to and collaborating…"
29,Research Impact Manager,Oxford Brookes University,Headington,"£36,382 a year","Full Time, Permanent - Professional Ser.Leading, participating, and developing the ways that the University engages with and shares its research with private,…"
30,AI/ML - Intern (Machine Learning Research),Apple,Cambridge,,"As part of Apple's Machine Learning and AI team, we transform every Apple product and because we fully integrate hardware and software, we can collaborate to…"
31,Senior AI/ML Research Engineer,Lloyd's Register Group,Remote in Leamington Spa CV31,,"Determining how AI and ML techniques can be applied to cybersecurity-related problems, including in particular the task of penetration testing."
32,Internship opportunities: Health Intelligence - Machine Lear...,Microsoft,Cambridge,,Work with an interdisciplinary team on healthcare applications of machine learning.Develop novel machine learning models and algorithms.
33,Natural Language Processing Engineers,Pangaea Data,London,,"Relevant work experience, including internships, full time industry experience or as a researcher in a lab.This is critical for detecting patients at risk of…"
34,VP Data Engineer - Athena Applied Intelligence - London,"JPMorgan Chase Bank, N.A.",London,,"It delivers innovative and efficient applications to a wide range of the firm's business, including sales, trading, operations, risk and research."
35,"Senior Product Manager - AI (Remote) London, England, United...",Infermedica,Remote in London,,"Our team is constantly growing and we are always on the lookout for top-notch specialists with technological, data science, marketing, sales, customer success,…"
36,Senior NLP Researcher,Pangaea Data,London,,"Relevant work experience, including full time industry experience or as a researcher in a lab.Pangaea Data Limited provides a machine learning based software…"
37,"Senior Business Development Manager, AI/ML Frameworks",AWS EMEA SARL (UK Branch),London,,"5+ years of business development, product management, management consulting, strategic partnerships, or enterprise sales experience."
38,Associate Market Researcher for Analytics Products,"Guidewire Software, Inc.",London,,"The Market Researcher stays current & up to date with the latest trends and developments in the insurance industry by researching, validating, documenting, and…"
39,Senior User Researcher - IBM CIC,IBM,Leicester,,"Taking a lead on scoping, planning, conducting and analysing the research by creating research plans, protocols and activities using qualitative, quantitative…"
40,Software Engineer – Embedded AI (open to permanent or 6 mont...,Samsung Electronics,Hybrid remote in Staines-upon-Thames,,This position will require you to work closely with researchers and engineers to enable and accelerate new research efforts for on-device AI.
41,"Senior Researcher, Public Sector Algorithms",Datatech Analytics,Hybrid remote in London,"£43,000 - £47,000 a year",The primary responsibilities will be to develop and execute Ada's strategy for the Public Sector Data and Algorithms.
42,"newResearch Associate, Neo-Couture RCA HKPU AiDLab PR3-7 (0.6 F...",Royal College of Art,London,"£32,198 a year","The School of Design offers programmes that engage with a broad spectrum of design from the industry-focused, through collaboration with engineering and science…"
43,Senior Machine Learning Researcher,PROWLER.io,Temporarily Remote in Cambridge,,"You will be working in highly collaborative research teams developing algorithms that are theoretically rigorous, yet scalable to domains of real-world…"
44,"Senior Software Engineer, Explainable AI (XAI) - Vice Presid...","JPMorgan Chase Bank, N.A.",London,,"Provide real-time visualizations for analysis by traders, researchers and risk managers.Great interpersonal skills and able to interface with a data scientists…"
45,Senior User Researcher,Consortia,London,,This role of Senior User Researcher will be given full autonomy so you will need to be confident to partner with high-level managers and bring your own vision…
46,Senior Postdoctoral Researcher in Biostatistics: Statistical...,University of Oxford,Oxford OX3,,We are looking to appoint a Senior Postdoctoral Researcher in Biostatistics: Statistical Machine Learning and Omics Analysis to develop novel statistical…
47,Team & Office Assistant - Commercial Teams (m/f/d) - London,DeepL SE,London W1F,,"You enjoy supporting commercial teams with event organisation, travel arrangements and internal documentation."
48,newSenior Research Scientist - Reinforcement Learning,nate,London,,"You've held a faculty research position or have 2+ years as an industry researcher.To tackle each of these domains, data scientists are paired with engineers…"
49,newResearch Scientist - ASR (Automatic Speech Recognition) / Ma...,Zoom,Remote in London WC1V,,It will also involve researching on different aspects of Speech including ASR (Automatic Speech Recognition).Research and develop state of the art ML Models.
50,UX - Senior UX Researcher,Ipsos,London,,Work with other user researchers to facilitate a consistent research approach.Opportunity to travel globally and working with regional teams across 90…
51,AI Research Product Manager Senior Associate - London,"JPMorgan Chase Bank, N.A.",London,,They pursue primary research in areas related to our research pillars as well as concrete problems related to financial services.
52,Business Development Intern (H/F),SESAMm,Remote in London,,"Work closely with other teams at SESAMm, including engineers (big data experts, researchers, quantitative analysts, data scientists)."
53,Talent Acquisition Partner (f/m/d) – London,DeepL SE,London,,"Own the recruiting process (full-cycle), whereby your good understanding of the target groups (e.g. developers, sales, support, finance) allows you to ensure…"
54,Internship opportunities: Deep Reinforcement Learning for Ga...,Microsoft,Cambridge,,"Working closely with researchers from Microsoft for the duration of 12 weeks, you will advance the state of the art in this space by developing novel models and…"
55,Senior Data Scientist,Omnicom Health Group,Hybrid remote in London W5,,"Effectively develop researcher understanding of statistical and advanced methods throughout the projects.This is a very interesting, challenging role working…"
56,Product Manager - AI Software Solutions,Graphcore,London+1 location,,The IPU’s unique architecture means developers can run current machine learning models orders of magnitude faster.
57,AI Applications Engineer,Graphcore,London+1 location,,The IPU’s unique architecture means developers can run current machine learning models orders of magnitude faster.
58,newInsights Consultant - Datasets,Black Swan Data Ltd,Remote in London,,"This role is a unique blend of Market Researcher and Product Owner for the Beverage Domain.The Beverage Domain includes 4 categories – Non-Alcoholic Beverages,…"
59,newSenior Content Designer,IBM,London,,Visualization is critical to discovering data-driven insights and effectively communicating that knowledge to others.
60,newSenior Investigative Data Scientist,Amnesty International,London,,"You will be excited to work with human rights researchers to scrutinise the use of algorithms in the public sector and develop a toolkit, or methods, with which…"
61,Product Manager for APIs,Neo4j,Remote in London,,"The ideal candidate will seamlessly interface with teams, taking on supporting roles ranging from researcher, facilitator, coordinator, sponsor, and subject…"
62,Senior/Lead User Researcher,IBM,London,,"You will be expected to build user-centred practices in new teams, align user research activities with wider plans to inform a service proposition and supervise…"
63,Senior Machine Learning Engineer - NLP (Remote),BenchSci,Remote in London+2 locations,,4+ years of experience working as a professional developer or researcher applying machine learning techniques to solve business problems.
64,Machine Learning Scientist - Flights,Booking.Com,London,,"At the same time your will be embedded in a product development team, working side by side with software developers, UX designers, copy writers, and user…"
65,Sales Specialist - London & South East - Ethicon,Johnson & Johnson,Wokingham,,"Teams from J&J’s consumer business are crafting digital tools to help people track the health of their skin.Within allocated geographical region, interact and…"
66,Product Director,Healx,Remote in Cambridge,,"You will be directly managing product managers, design/UX, and researchers and working with them to build out capabilities in collaboration with Engineering…"
67,Senior Software Engineering & Data/ML Engineering Lead,"JPMorgan Chase Bank, N.A.",London,,"Senior Software Engineering & Data/ML Engineering Lead.It delivers innovative and efficient applications to a wide range of the firm's business, including…"
68,Software Engineer,Samsung Electronics,Hybrid remote in Staines-upon-Thames,,This position will require you to work closely with researchers and engineers to enable and accelerate new research efforts for on-device AI.
69,Full-stack Developer,EY,London SE1,,"Digital strategy, horizon scanning, and strategic planning.We have a range of skills across programme management, solution architecture, product management,…"
70,Junior Software Engineer,Hawk-Eye Innovations,London+1 location,,"Junior Software Engineer - Computer Vision.A day in the life of a Computer Vision Engineer.As a computer vision engineer at Hawk-Eye Innovations, you will be…"
71,newQuality Assurance Manager,EY,London E14,,"Digital strategy, horizon scanning, and strategic planning.We have a range of skills across programme management, solution architecture, product management,…"
72,Regional Sales Associate (M/F),SESAMm,London,,"Specialization: creation of innovative analytics and alternative data – we analyze in real time billions of messages, articles and posts from millions of data…"
73,Technical Specialist - North London Region,Johnson & Johnson,Wokingham,,Teams from J&J’s consumer business are crafting digital tools to help people track the health of their skin.We have an exciting and challenging role within our…
74,newDirector of the Humanities Cultural Programme,University of Oxford,Oxford OX2,,The Humanities Division is now looking to appoint the inaugural Director to lead and inspire the Humanities Cultural Programme (HCP) in the run-up to the…
75,"newAI Engineer (Front End), Advanced Prototyping Team",IBM,Hursley,,"You will work with innovative AI, hybrid cloud, and quantum computing technologies on use-cases aligned to IBM’s strategy and client priorities."
76,newClinical Research Fellow in Data Science and Critical Care,University College London Hospitals NHS Foundation...,London NW1,,This fellowship is suitable for clinicians who wish to combine a year of clinical work in critical care with a digital health / data science research post.
77,NLP Data Scientist,NOKIA,Cambridgeshire,,"Social Dynamics Research, Nokia Bell Labs, Cambridge, UK.Candidates who have the aspiration to work in a highly-dynamic research environment with a focus on…"
78,Senior Data Scientist,The Planning Shop,Hybrid remote in London W5,,"Effectively develop researcher understanding of statistical and advanced methods throughout the projects.This is a very interesting, challenging role working…"
79,Marketing Technology Senior Consultant,EY,London SE1,,"Digital strategy, horizon scanning, and strategic planning.We have a range of skills across programme management, solution architecture, product management,…"
80,LLVM Developer,Graphcore,Cambridge,,The IPU’s unique architecture means developers can run current machine learning models orders of magnitude faster.Working on the IPU architecture compiler.
81,Systems Operations Engineer,Graphcore,Cambridge,,The IPU’s unique architecture means developers can run current machine learning models’ orders of magnitude faster.Good communication and presentation skills.
82,"AI/ML- Software Engineer, ML Platform and Technology (Privac...",Apple,Cambridge,,"Ability to quickly learn and modify large, existing codebase.Proficient in one or more of Java, Python, C++, Objective-C or Swift."
83,Research Fellow,University of Warwick,University of Warwick,,To identify and explore with the Departments and the University any entrepreneurial opportunities which may arise and to ensure that intellectual property…
84,Software Engineer,University of Warwick,University of Warwick,,This role will sit with a team of data science and computational pathology researchers utilising the TIA team’s research computing and storage facilities.
85,newRobotics Research Software Engineer,CCFE,Culham,,"Provide robotics software expertise to help researchers, aid with project planning, and contribute to wider RACE projects.PhD in relevant subject area."
86,Ethicon Biosurgery Sales Specialist - London & Oxfordshire,Johnson & Johnson,Wokingham,,"Teams from J&J’s consumer business are creating digital tools to help people track the health of their skin.Within allocated geographical region, interact and…"
87,Head of COE RWD Analytics,UCB S.A.,Slough,,"The incumbent will provide people leadership and strategic direction for flawless execution of all internal RWD analysis, having the appropriate skills, tools…"
88,Senior Research Scientist - NLP,nate,London,,"You've held a faculty research position or have 2+ years as an industry researcher.To tackle each of these domains, data scientists are paired with engineers…"
89,newPrecision Medicine Data Core - Technical Architect,Barts Health NHS Trust,London E1,,The Barts Life Sciences is recruiting a technical architect to help develop and implement and exciting initiative to find new and personalised ways to treat…
90,Project Manager,Satalia,London N1,,"Role type: Permanent, Full Time.As a Project Manager, you’ll play a pivotal role within Satalia.You will be driving high performing teams, and applying your…"
91,Procedural Engineer,Wayve,London,,You'll be working closely with our Simulation team to create flexible procedural systems to generate a huge range of worlds that emulate the variety and…
92,"Senior Manager, Customer Service Transformation Specialist,...",Deloitte,London,,"Experience working on digital delivery projects such as a business analyst, agile coach, delivery manager, product owner, user researcher, CX/UX designer and or…"
93,Social Intelligence and Analytics- Associate Director,Ipsos,London,,"You will be an experienced researcher with social and search data.Social Intelligence Analytics is developing at breakneck speed, facilitated by both greater…"
94,"Senior Research Scientist, Reinforcement Learning",Spotify,Remote in London,,"You will work in collaboration with other scientists, engineers, product managers, designers, user researchers, and analysts across Spotify to design creative…"
95,Senior Data Scientist,PROWLER.io,Temporarily Remote in Cambridge,,"You will be providing software engineering solutions to improve the quality of, and provide confidence in, the complex systems being developed."
96,Solutions Architect,Pangaea Data,London,,"Relevant work experience, including internships, full time industry experience or as a researcher in a lab.This is critical for detecting patients at risk of…"
97,Senior Research Scientist and Engineer – Mixed Reality & AI,Microsoft,Cambridge,,We bring innovative new technologies and experiences from early-stage research to deployment in Microsoft products.High- and low-level code optimization.
98,newMachine Learning Engineer,Understanding Recruitment,Remote in London,,"As a Machine Learning Engineer, you will be proficient with Python programming, have previous recommendations and/or search engine experience, and keen to work…"
99,Solutions Architect,Springer Nature,Remote in London,,"The Cyber Security Team is responsible for the monitoring, vulnerability management, assurance, security architecture, infrastructure, and the secure…"
100,"Associate Scientific Editor, Patterns",RELX,Remote in London,,Our aim is to share data science solutions to problems that cross domain boundaries and support our authors in communicating their work to the global research…
101,Cloud Software Engineer - Python - VP,"JPMorgan Chase Bank, N.A.",London,,"It delivers innovative and efficient applications to a wide range of the firm's businesses, including sales, trading, operations, risk and research."
102,Sales Specialist - DePuy Synthes Trauma - North London,Johnson & Johnson,London+1 location,,"Teams from J&J’s consumer business are crafting digital tools to help people track the health of their skin.Within allocated geographical region, interact and…"
103,Machine learning and Genomics Researcher - London,Paramount Recruitment Ltd,London,,"As they scale up their science program, they will be increasing their protein related research, one of their current AI systems can already predict the shape of…"
104,Senior QA Engineer,KPMG,London,,Service Line: Tech Digital Lighthouse.You will have to demonstrate excellent problem-solving skills and being able to come up with creative solutions.
105,Data Engineer,Healx,Remote in Cambridge,,"Working with engineers, AI researchers, product managers, and scientific specialists such as pharmacologists in a positive, collaborative environment to…"
106,"Senior Software Engineer, AI/ML Production",GSK,London+1 location,,"Introduce new third-party tools that facilitate software development and machine learning to a team composed of scientists, researchers, data scientists and…"
107,Research Scientist: Reinforcement Learning,BAE Systems Applied Intelligence,Hybrid remote in Great Baddow,,"You should have existing skills in Artificial Intelligence or neural net based machine learning.You will also need to be a proficient programmer, particularly…"
108,Quantitative Analytics and Electronic Trading Associate - Ex...,Barclays,London E14,,"Our quants are highly specialised quantitative traders, researchers, and data scientists responsible for developing, deploying and running algorithmic trading…"
109,Senior Analytics Consultant,KANTAR,London,,"3 to 4 years’ experience in client facing environments, leading analytics projects for clients, handling commercial discussions and collaborating with small…"
110,newEngineering Recruitment Coordinator - 12 Month Fixed Term Co...,Bloomberg,London,,"This role will involve partnering closely with our recruiters and software engineers to hire the best technical talent into Bloomberg, working in a fast-paced,…"
111,Turing ULM and Research Centre Coordinator (Fixed Term),University of Cambridge,Cambridge,"£31,406 - £40,927 a year",C2D3 is an IRC (Interdisciplinary Research Centre) for cross-school activities in the thematic areas of data science and AI.
112,Full Stack Web Developer,Pangaea Data,London,,"Relevant work experience, including internships, full time industry experience or as a researcher in a lab.This is critical for detecting patients at risk of…"
