,title,company,location,salary,summary
106,lead software engineer (rights sound recording),SoundExchange,"Remote in Washington, DC 20001",,"Manage a small team of full stack engineers.Collaborate across small Agile teams to design, develop, test, and support data driven solutions."
107,VMware Design and Operations Engineer,Concept Plus,"Remote in Fairfax, VA 22033",,"Responsible for leading and implementing VDI design, implementation, and support in a secure cloud environment leveraging DevSecOps.Must be a US Citizen."
108,Remote ASIC Design for Test Consultant,Siemens,"Remote in Reston, VA 20191",,"RTL design experience is a plus.Siemens EDA (formerly Mentor Graphics) is a global technology leader in Electronic Design Automation, providing software and…"
109,newUX Designer/Developer,Leidos,"Bethesda, MD 20889",,"Illustrate design ideas using storyboards, diagrams, and sitemaps.Gather and evaluate user requirements in collaboration with product managers and engineers."
110,Senior Network Design Engineer,UltiSat,"Remote in Laurel, MD",,Update the existing design documents with new design changes.Create new IP network design documents.Provide network engineering solutions to customers through…
111,Principal RF Microwave Design Engineer,EchoStar,"Germantown, MD",,Take a product from design to production phase.This involves design and simulations along with bench characterization on RF/Microwave boards.
112,Web Developer I,Associated Builders & Contractors,"Washington, DC 20001 (Swampoodle area)",,"Assist the web team in various duties such as: design, development, maintenance and performance of our sites.Create and maintain software documentation."
113,Antenna Design Engineer: TS/SCI Poly,CACI,"Annapolis Junction, MD 20701",,Conducts advanced studies and research on the latest RF designs and innovations to improve on the design and performance of related equipment.
114,Senior Full-Stack .Net Developer,Mindcubed LLC,"Washington, DC",,"Knowledge of common application and Web design patterns.Minimum 10 years of experience with C#, .NET, MS SQL, MVC, Net Core, Agile/SCRUM."
115,Design Project Engineer II,IPS-Integrated Project Services,"Rockville, MD 20850+1 location",,"Monitors design content and quality and coordinates design revisions for constructability and compliance with basis documents, schedule, and budget."
116,"Senior Manager, Satellite Terminal Hardware Design",Veterans Enterprise Technology Solutions,"Germantown, MD+1 location",,5+ years leading cross functional engineering teams in design and development projects with external customer deliverables.
117,Audio Visual (AV) Senior Design Engineer,Serco North America,"Remote in Arlington, VA 22202",,Creates Bill of Materials for every design.Gather customer requirements and design audio-visual systems based on customers’ needs.CTS or CTS-i certification.
118,Senior Electronic Design Engineer,EchoStar,"Gaithersburg, MD",,"The areas of interest are high-speed digital hardware design, complex FPGA development, and circuit design utilizing mixed signal ASICs."
119,Media Broadcast Engineer,BAE Systems,"Washington, DC 20024 (Southwest Waterfront area)",,Provide broadcast media engineering support including;Technical assistance for broadcast and IT-related on-site equipment.
120,Senior-Network Design Engineer (Government),AT&T,"Columbia, MD",,The engineer will work as part of a system design team to research emerging technologies and implement new solutions.VPN configuration is a plus.
121,Web Developer & Designer,The Lukens Company,"Remote in Arlington, VA 22206",,"Working with teammates to deliver web development and design deliverables on time, within budget, and to a standard of quality expected by ourselves and clients…"
122,Integrated Circuit Design and Test Consultant,Booz Allen Hamilton,"Remote in McLean, VA 22102",,Experience with FPGA design preferred.Experience with printed circuit board (PCB) design preferred.1+ years of experience bringing integrated circuit designs…
123,Electrical Design Engineer,WSSC Water,"Laurel, MD",,Leads engineers and other technical personnel in the development and design of varied large complex projects.Drives a vehicle to conduct WSSC Water business.
124,Application Design Engineer,Schneider Electric,"Ashburn, VA 20147",,"Reports design, quality, reliability and maintenance problems or bugs to design engineering/software engineering."
125,Hardware Design Engineer,InterImage,"Fort Meade, MD",,Seven (7) years experience as a Hardware Designer in an integrated circuit or microelectronic component design or reverse engineering of the same is required.
126,Senior RF Design Engineer,RevGo Global,"Reston, VA 20191 (Hattontown area)",,The candidate may be required to lead an RF design team with a focus on design to cost and schedule goals.Experience with designs for frequencies up to 40 GHz.
127,Web Developer - Healthcare,"HRS Consulting, Inc.","Washington, DC 20571 (Downtown area)",,Supporting the development of healthcare related visual communication and visualization of progress towards achieving objectives for internal and external…
128,Lead Application/Game Designer,Virtual Media Group,"Bethesda, MD",,Create clear and specific game design documents.Oversee the areas of development as it pertains to the design team.Draw up new ideas and concept proposals.
129,"RF Electronics Design - Electrical Engineer II - Tucson, AZ",Raytheon Missiles & Defense,"Washington, DC 20011 (Catholic University-Brookland area)+1 location",,This role includes design and test activities that span preliminary design to integration.Analog or RF design coursework.
130,SharePoint Architect,G2 Global Solutions,"Remote in Washington, DC 20001",,Create intuitive UI design solutions.Execute all UI with visual design polish.Experience with web design and front-end development.
131,Senior Engineer - Secure Design,Walter P Moore,"Washington, DC 20006 (Downtown area)+1 location",,Vehicle barrier analysis and design.Demonstrated career growth that includes 3+ years project management of secure design projects preferred.
132,Senior Network Design Engineer,PAE,"Falls Church, VA 22043",,"Conduct testing of network design both in a lab environment, and a live environment.Work in close coordination with the customer, Project Managers, and other…"
133,Network Design Engineer,COMPQSOFT,"Fort Meade, MD",,"In preparation of migration, review the Circuit Layout Record/Design Layout Record (CLR/DLR) to ensure Paragraph 3 of the TSO is correct IAW the approved…"
134,newSoftware Development Engineer,CVS Health,"Chantilly, VA",,CVS Health’s mandate is to transform health and wellness via products that enable consumer engagement and best-in-class experience.
135,lead software engineer (rights sound recording),SoundExchange,"Remote in Washington, DC 20001",,"Manage a small team of full stack engineers.Collaborate across small Agile teams to design, develop, test, and support data driven solutions."
136,Power Supply Design Engineer,Johns Hopkins Applied Physics Laboratory (APL),"Laurel, MD 20724",,Support design reviews and contribute to advancing the architectural considerations of power supply designs.We're a group of about 40 engineers with technical…
137,RF Design Engineer,BlueHalo,"Columbia, MD 21046",,"Not afraid to ask questions, or challenge design decisions to improve overall design and outcome of projects and tasks."
138,Electrical Engineer II - Digital Design,Raytheon Missiles & Defense,"Washington, DC 20011 (Catholic University-Brookland area)+10 locations",,"Experience with embedded test techniques, design for test, design margin analysis and design for production.Experience with PCB design tasks and proven ability…"
139,Web Developer I,Associated Builders & Contractors,"Washington, DC 20001 (Swampoodle area)",,"Assist the web team in various duties such as: design, development, maintenance and performance of our sites.Create and maintain software documentation."
140,Senior FPGA Design Engineer (East Coast),Silvus Technologies,"Washington, DC",,"FPGA design synthesis and timing closure.4+ years of FPGA design experience required.Experience with multiple clock-domain, high-speed, high-utilization FPGA…"
141,Solutions Design Engineer - Warehousing & Distribution (REMO...,Ryder System,"Remote in Washington, DC 20080+2 locations",,"Execute design processes to create, re-design, or optimize logistics networks.Warehousing design and layout experience."
142,VMware Design and Operations Engineer,Concept Plus,"Remote in Fairfax, VA 22033",,"Responsible for leading and implementing VDI design, implementation, and support in a secure cloud environment leveraging DevSecOps.Must be a US Citizen."
143,Software Engineer (DevOps),Bigbear.ai,"Columbia, MD 21046",,BigBear.ai is seeking a Software Engineer with DevOps experience to support our research contract.This position will support our Intelligence Division.
144,Senior Analog RF Design Engineer,Veterans Enterprise Technology Solutions,"Gaithersburg, MD",,"RF/Analog circuit design experience, etc.5+ years of experience in design and development of RF/analog boards or systems."
145,Transportation Design Engineer IV,Maryland Department of Transportation,"Anne Arundel County, MD+1 location",,"Knowledge in the design and review of traffic control device plans.This position is accountable for design and management of multiple projects, including…"
146,Software Developer,Dezign Concepts LLC,"Chantilly, VA 20151",,Demonstrated experience in software systems applications to design and develop tools that integrate with commercial applications.Net or Apache Tomcat servers.
147,"Design Engineer, Junior","USfalcon, Inc.","Washington, DC+2 locations",,Provide engineering/technical support for concept studies; feasibility studies; preliminary design activities; contract design activities; detail design and…
148,"newElectronic Design Automation Engineer, Senior",Booz Allen Hamilton,"Arlington, VA",,We’re looking for skilled engineers to help drive advancements in microelectronics research for the DoD.Work with world-class scientists and engineers for a…
149,Application Engineer,Bigbear.ai,"Columbia, MD 21046",,Strong web design and front end UI/UX experience.BigBear.ai is seeking an Application Engineer to develop and manage software tools in support of Enterprise…
