,title,company,location,salary,summary
114,Senior Product Designer,Wellframe,"Boston, MA 02210 (Downtown area)",,We’re looking for a Senior Product Designer who will play a key role in creating our internal tools and platforms within Wellframe.
115,"Lead / Principal Product Designer - Mulesoft, a Salesforce C...",Salesforce,"Boston, MA 02116 (Back Bay area)",,"MuleSoft offers a range of products, from robust IDEs for developers, to low-code integration tools for business users."
116,SFDC UX Architect,NTT DATA,"Boston, MA 02129",,"Our UX Architects are fundamental to ensuring the digital technology and related services that NTT DATA builds for our clients are valuable, intuitive, and…"
117,"Product Designer - Opportunity for Working Remotely Boston,...",VMware,"Remote in Boston, MA",,"As part of a highly collaborative group of creative problem solvers with a passion for innovation, you will build intuitive, and meaningful products in the…"
118,Principal Product Designer (Remote),Omnicell,"Remote in Boston, MA",,Experience coaching and mentoring less experienced designers.Can articulate design principles & decisions to non-designers.
119,Strategic Designer,Bain & Company,"Boston, MA 02116 (Back Bay area)",,Our Strategic Designers are the backbone of our design capability.In this role you will apply a user centered design approach to create impactful digital…
120,Director of Product Design,Klaviyo,"Remote in Boston, MA",,You will lead and grow a team of product designers and work with multiple product groups that are tasked with helping customers utilize their own data and…
121,"Conversational Artificial Designer, Senior Consultant - Appl...",Deloitte,"Boston, MA 02116 (Back Bay area)+2 locations",,"As a rigorous language-first UX designer with a creative flair for content and expertise in conversational AI technologies, you'll:"
122,"Senior Graphic Designer, Office of Communications",Suffolk University,"Hybrid remote in Boston, MA 02108",,"Serve as a mentor for junior designers and/or student interns.Suffolk offers a generous benefits package that included medical, dental, retirement/403b plan,…"
123,"Lead Impact Experience Designer, Salesforce Impact Innovatio...",Salesforce,"Boston, MA 02116 (Back Bay area)+1 location",,"Work with designers, strategists, technologists, and account teams to conduct specific innovation engagements with key customers and partners."
124,"Lead Product Designer, Digital Experience Team",State Street,"Boston, MA 02111 (Central area)",,"Ability to guide and direct design conversation whether with business stakeholders or other designers.As you lead your own project, will you guide and support…"
125,Sr. UI Designer GPS - Location Open,Deloitte,"Boston, MA 02116 (Back Bay area)+1 location",,"Collaborate with other groups like developers, engagement managers and UX designers to deliver high-quality creative for both internal and client-facing…"
126,UX Product Designer - IR Intelligence,"Nasdaq, Inc.","Boston, MA 02101",,Design wireframes & mockups for desktop and mobile platforms.Build and quickly iterate interactive prototypes in response to client feedback.
127,Product Designer,Voicify,"Boston, MA 02110 (Downtown area)",,You’ll shape Voicify’s user experience collaborating with cross-disciplinary teams to bring your visions to life.5+ years of experience in a similar role.
128,Sr Human Factors Design Engineer - Surgical Robotics,Medtronic,"Boston, MA",,"Your focus will be on evaluating new designs for fit with surgeons’ and OR staff’s expectations and abilities, with a particular eye towards safety and ease of…"
129,Senior Content Designer,Klaviyo,"Remote in Boston, MA",,"Collaborate with product managers, engineers, designers, and cross functional stakeholders to understand business objectives, needs, and constraints while…"
130,Senior UX Designer,ENEL,"Boston, MA 02210 (South Boston area)",,"You have the ability to do some visual designs when called upon.Independently lead User Research activities to develop personas, understand key customer…"
131,Senior Product Design (UX) Manager,Wayfair,"Boston, MA+11 locations",,"Collaborate with product managers, developers, content strategists, user researchers, and other experience designers to execute design concepts that deliver on…"
132,"newEngineer III, Human Factors Design",Thermo Fisher Scientific,"Boston, MA",,Will focus on delivering product innovation through compelling user experiences and creative visual designs.Will play an integral part in our Experience Design…
133,Senior Product Designer,Wellframe,"Boston, MA 02210 (Downtown area)",,We’re looking for a Senior Product Designer who will play a key role in creating our internal tools and platforms within Wellframe.
134,"Product Designer - Opportunity for Working Remotely Boston,...",VMware,"Remote in Boston, MA",,"As part of a highly collaborative group of creative problem solvers with a passion for innovation, you will build intuitive, and meaningful products in the…"
135,Senior UX Designer,Edelman Financial Engines,"Boston, MA 02203 (Central area)",,"Identify and drive opportunities to grow the culture of design within the organization, including mentoring other designers and driving internal initiatives."
136,"Senior User Experience Designer (Acorn AI, a Medidata Compan...",Medidata Solutions,"Boston, MA 02116 (South End area)",,The UX designer will work in close collaboration with other project designers and product managers to create a high quality user experience that supports user…
137,Senior UX Designer,Ascensus,"Boston, MA 02212 (Central area)",,Design the user experience for web and mobile solutions that help millions of people achieve their financial goals.
138,Instructional Designer,Silicon Valley Bank,"Remote in Boston, MA 02111",,"The Instructional Designer is responsible for designing, developing, and delivering high impact sales training and tools that are experiential, drive behavior…"
139,207815WD SAP UX Architect Senior Associate (Evergreen) (Clos...,PRICE WATERHOUSE COOPERS,"Boston, MA 02210 (South Boston area)",,"Demonstrating proven ability using API designer and Open APIs to create omni channel mobile experience;Use feedback and reflection to develop self awareness,…"
140,newUX Designer,"W.B. Mason Company, Inc","Boston, MA 02210 (South Boston area)",,You will contribute to a user-centric design approach to ensure high adoption and customer engagement.This role will primarily contribute to the design of our…
141,newLead UX/UI Designer (remote),Toast,"Remote in Boston, MA 02215+1 location",,"Inspire and mentor fellow UI and UX designers.You are a key contributor to growing our design system, working closely with other UI and UX designers and…"
142,newProduct Designer (UI/UX),Recruiting From Scratch,"Remote in Boston, MA 02199+3 locations",,"Creating a high quality, forward thinking, and emotionally engaging visual aesthetic.Creating new ways for users to seamlessly interact with Web3."
143,newUX Designer,Ethos,"Boston, MA",,"UX Designer *(Remote) (full-time, permanent hire position with full benefits package from day 1 of employment)*.WCAG design experience is a plus."
144,newUX UI Designer,Lakarya LLC,"Boston, MA 02110 (Downtown area)",,"Provides design mentorship to other designers on the team.Education/Experience Required: Bachelor's degree (or higher) in HCI, Computer Science, Design, or…"
145,newSTAT - Product Designer (UI/UX),Boston Globe Media Partners,"Boston, MA 02109 (Downtown area)",,This position will report to the Director of Product Design & Visual Strategy and will work closely with our product and engineering teams to transform business…
146,UI/UX Designer,Cervello Inc,"Boston, MA 02210 (South Boston area)",,"Experience working with a diverse team of designers, developers, product owners, and client stakeholders.Designers are expected to build a strong foundation…"
147,1623 UX Designer,Infoorigin inc,"Boston, MA",,We are seeking an experienced and highly motivated UX Designer with an interest in quantitative finance to join the Cloud Development team to help design and…
148,UX UI Designer (W2 Only),Mastech Digital,"Boston, MA 02110 (Downtown area)",,Provides design mentorship to other designers on the team.Translates concepts and requirements into an end-to-end user experience and chooses the appropriate…
149,Product Designer,Reify Health,"Remote in Boston, MA",,"You will design and build products that reshape how clinical research organizations and professionals interact with each other, share information, and develop…"
