,title,company,location,salary,summary
115,Senior User Experience Designer - McKinsey Digital,McKinsey & Company,"Bengaluru, Karnataka",,Experience leading designers and other members of a cross-functional team.You will be part of a blended cross-functional team and tackle all aspects of the…
116,User-experience designer (UX),Klevu Oy,"Bengaluru, Karnataka",,"Proactively engage with multiple project stakeholders, including product managers, engineers, and other designers, in drafting and brainstorming initial…"
117,UX Designer (Remote),Foxmula Private Limited,"Remote in Bengaluru, Karnataka",,"Collaborative design with other partners viz. product management, marketing, technical architect, developers and visual designers."
118,Product Designer,Truecaller,"Bengaluru, Karnataka",,"As a Product Designer you will develop and improve the experience of Smart SMS features of Truecaller, primarily for Android."
119,UI/UX Designer,Standard Chartered,"Bengaluru, Karnataka",,Collaborate with the Product Management teams and share learnings with wider designer communities within SCB.Executing all visual design stages from concept to…
120,newJr. UI-UX Designer/Developer,Coddle Technologies Pvt Ltd,"Bengaluru, Karnataka",,Junior UI-UX Designer or Developer (0 Months to 2 years)*.UI-UX Engineer requires learning and interpreting the needs of the users and express concepts and…
121,UX Designer,Jeeva Organic,"Bengaluru, Karnataka",,Attention to detail with emphasis on accuracy and quality.Identifying design problems and devising with elegant Solutions.
122,UX Designer,Drishti,"Bengaluru, Karnataka",,Drishti is a leading computer vision (AI) company that uses video analytics to provide business insights.You are expected to develop an understanding of the…
123,Product Manager,GO-JEK,"Bengaluru, Karnataka",,"You must have experience in working with product designers and have an eye for design.You will work alongside other Product Managers, Engineering, BI Analysts,…"
124,Product Designer,PayPal,"Bengaluru, Karnataka",,"Create high-quality deliverables with some oversight and guidance from a senior designer, within timelines and project requirements."
125,UX-Senior Product Designer,CredAvenue,"Bengaluru, Karnataka",,"Switching between platforms is easy, which means investors can lend, invest and trade bonds - all in one place.Ability to work with multiple stakeholders."
126,UI/UX Designer,AssetCorp Technologies,"Bengaluru, Karnataka",,"Must have Good Knowledge of Programming.Design graphics user interface elements, like menus, tabs, and widgets."
127,Website Designer,Nextwebi,"Bengaluru, Karnataka","₹7,50,000 a year",IT Software- Developing and Maintaining websites.IT Software- Developing and Maintaining websites.Should have the ability to adapt to the latest technologies…
128,Senior UX Researcher – Bangalore,PeepalDesign,"Bengaluru, Karnataka",,Collaborate with product managers and designers to understand their requirements and be able to give recommendations accordingly.
129,UI/UX Designer,Vibrant Info,"Bengaluru, Karnataka",,"Good Knowledge of Photoshop, Corel Draw, Adobe Illustrator.After Effects, Adobe XD, Adobe Premiere Added Advantage."
130,UX Designer,Cotech Innovations,"Bengaluru, Karnataka",,Strong online portfolio with demonstrated examples of designing great user-centered experiences and applications.May be substituted with significant industry.
131,UX Designer,InstaSafe,"Bengaluru, Karnataka",,"Strong product skills with deep intuition for usability, but a willingness to let go of your instincts and listen to data and user feedback."
132,"Senior UX Designer , IN Delivery Experience",ADCI - Karnataka,"Bengaluru, Karnataka",,"Provide mentorship for designers and interns.Collaborate with cross-functional teams like product managers, developers, and designers."
133,UX Designer Profile Requirements,AlgoShack,"Bengaluru, Karnataka",,"3+ years proven experience as a UX Designer, UI Designer.Strong portfolio of design projects.Familiarity with interaction design and information architecture."
134,Lead UX Designer,Piktorlabs,"Bengaluru, Karnataka",,"Experience working with multi-disciplinary teams of technologists, researchers, client stakeholders, business analysts, visual designers, etc."
135,UX Researcher,Shopgro,"Bengaluru, Karnataka",,"With considerable experience, you evaluate all the features contributing to user experience, providing expertise, collaborating internally and occasionally…"
136,Senior User Experience Designer,Adobe,"Bengaluru, Karnataka",,"Prior experience crafting products for designers, artists, and other creatives.Collect and act on feedback from fellow designers, cross-functional partners,…"
137,"Product Manager, Help Experience",GO-JEK,"Remote in Bengaluru, Karnataka",,"As a Product Manager in Care, you will work alongside other Product Managers, Engineering, Care operations, BI Analysts, Data Science, Customer Research, UX…"
138,UX-UI Designer,Nutanix,"Bengaluru, Karnataka",,"We are looking for someone who is passionate about solving complex problems, and whose work demonstrates strong design aptitude for enterprise-level product…"
139,newGraphic Designer,The Betel Leaf,"Bengaluru, Karnataka",,"Stategize give , design, and produce high quality design for various marketing communication materials across different and mediums."
140,UX Manager (Contract),Sephora Cosmetics Pvt Ltd (India),"Bengaluru, Karnataka",,"Mentor & guide junior UX designers within squads.This is a senior-level role that requires team management experience, as you will be required to guide junior…"
141,Junior UI/UX Designer,GoProtoz,"Bengaluru, Karnataka",,Gather and evaluate user requirements in collaboration with product managers and engineers.Understand product specifications and user psychology.
142,newUX-Lead Product Designer,CredAvenue,"Bengaluru, Karnataka",,This role will primarily be responsible for design experience of one of CredAvenue’s product while also mentoring a team of designers.
143,Sr. UX Designer,Yara,"Bengaluru, Karnataka",,"Smallholder regions are characterized by low living standards, high rates of illiteracy and low agricultural productivity."
144,UX Designer,Nuchange Informatics,"Bengaluru, Karnataka",,We are looking for a star UI/UX designer with 2+ years of experience who could work with us part time(minimum 20 hours/week).
145,UI UX Designer,Sketch Brahma Technologies,"Bengaluru, Karnataka",,"Translate concepts into user flows, wireframes, mock-ups and prototypes that lead to intuitive user experiences."
146,newVP - UX Designer - 210269012,abc consultants,"Bengaluru, Karnataka",,Bachelor’s degree or equivalent experience.Experience leading small- to-medium-sized teams.Significant experience designing and delivering world-class digital…
147,User Experience Designer,Tata Elxsi,"Bengaluru, Karnataka",,Tata Elxsi brings together the best technology and user-centric design expertise to help customers deliver innovative solutions and great consumer experiences.
148,"UX Designer, Payment Products",ADCI - Karnataka,"Bengaluru, Karnataka",,"You are a designer with 5+ years of experience working on real products that people use every day.Work closely with product owners, software developers,…"
149,User Experience Manager,Nextuple India Pvt Ltd,"Temporarily Remote in Bengaluru, Karnataka",,1+ years experience with leading or managing a team of UX designers.Develop and manage a team of motivated UX designers to deliver high quality products.
