,title,company,location,salary,summary
108,PROPOSAL WRITER,Axiom Resource Management,"Falls Church, VA 22042",,"Location: Falls Church, VA Seeking a Proposal Writer responsible to develop accurate, compelling messaging and high-quality content for winning proposals.…"
109,Tolling Analyst,HDR,"Vienna, VA",,"Tolling Analyst - (163195) Description About Us At HDR, we specialize in engineering, architecture, environmental and construction services. While we are…"
110,Senior Instructional Designer,"Bravo Consulting Group, LLC","Chantilly, VA",,"Title: Senior Instructional Designer Location: Herndon/Chantilly, VA Job Summary: Do you want to develop training that will transform national security? As…"
111,Water Resources Designer / EIT,HDR,"Vienna, VA",,"Water Resources Designer / EIT - (166072) Description About Us At HDR, we specialize in engineering, architecture, environmental and construction services.…"
112,Utility Management Services Project Manager,HDR,"Vienna, VA",,"Utility Management Services Project Manager - (166664) Description About Us At HDR, we specialize in engineering, architecture, environmental and…"
113,devops automation engineer,SoundExchange,"Washington, DC 20001 (Downtown area)",,"Company SoundExchange collects and distributes digital performance royalties on behalf of more than 260,000 creators and to date has paid nearly $9 billion…"
114,Senior Proposal Manager,ASRC Federal Holding Company,"Remote in Beltsville, MD 20705",,Looking for a home and to join a team that has an excellent track record of winning? Join us and enjoy a great company culture and highly collaborative and…
115,Aviation Engineer,HDR,"Fulton, MD+1 location",,"Aviation Engineer - (165304) Description About Us At HDR, we specialize in engineering, architecture, environmental and construction services. While we are…"
116,Proposal Manager,"Akima, LLC Shared Services","Herndon, VA",,"Akima is a global enterprise with more than 8,000 employees, delivering agile solutions to the federal government in the core areas of facilities, maintenance…"
117,Senior Instructional Systems Designer,Noblis,"Reston, VA 20191 (Hattontown area)",,"Responsibilities: As a Senior Instructional Systems Designer at Noblis, you’ll work with subject matter experts, scientists, and clients to capture learning…"
118,Mid-Atlantic Strategic Communications Manager,HDR,"Vienna, VA",,"Mid-Atlantic Strategic Communications Manager - (166270) Description About Us At HDR, we specialize in engineering, architecture, environmental and…"
119,Northern Virginia / DC / Maryland Roadway Lead,HDR,"Vienna, VA",,"Northern Virginia / DC / Maryland Roadway Lead - (164066) Description About Us At HDR, we specialize in engineering, architecture, environmental and…"
120,Senior Project Manager (Transportation),HDR,"Vienna, VA",,"The primary duties of the Project Manager include planning and managing all aspects of small to large multidiscipline projects, providing technical guidance to…"
121,Proposal Writer,Cape Fox Shared Services,"Manassas, VA 20109",,"Conceptualizing, writing, revising, reviewing, and editing documents from inception to final delivery that highlight company core capabilities and technical…"
122,Traffic Engineer,HDR,"Fulton, MD",,"Function as a technical specialist on mid-size projects, including roadway and intersection design.Work cooperatively with other team members, operations…"
123,Bridge Designer / EIT,HDR,"Vienna, VA+1 location",,"Assist in writing of memorandums and technical reports.As a Bridge EIT, you will be assisting a Senior Structural Engineer, and we will count on you to:"
124,Rail Bridge Engineer,HDR,"Vienna, VA",,"Serve in a technical role, under the direction of a Project Manager.Oversee the work of EITs and Junior Project Engineers.PE or in the process of obtaining."
125,Senior Rail Engineer,HDR,"Vienna, VA",,Serve as a technical expert with recognized authority in an area of specialization that resolves problems of greater scope and complexity while planning and…
126,Character Artist,Radical Convergence,"Reston, VA 20190 (Sunset Hills area)",,"3+ years’ experience as a 3D artist or relevant portfolio.Conceptualize, present, and execute ideas within a schedule, while actively participating in…"
127,Assistant Preparator,The Phillips Collection,"Washington, DC 20009 (Dupont Circle area)",,"Develop technical installation-related drawings, including for construction, exhibition furniture, and object placements.Able to lift a minimum of 50 lbs."
128,$17.25/hr Warehouse Technician,Spin Fleet Operations (North America),"Washington, DC",,"Prior technical or repair experience.You will work with the latest electric scooter hardware, from routing repairs, diagnosing new issues, to rebuilds."
129,Live Music Promoter (CityRep),youbloom,"Temporarily Remote in Washington, DC",,*Recruitment and programming of artists/bands (including drawing on artists in the youbloom data base)*.Youbloom took off in 2009 as a weekly song contest.
130,Sr. Graphics Artist,Quevera LLC,"Annapolis Junction, MD 20701",,Minimum of 10 years of experience in technical writing or related field.The Graphic and Web Designer would be responsible for all in-house graphic design and…
131,Summer Camp Instructor-Writing,Arena Stage,"Washington, DC 20007 (Georgetown area)+3 locations",,Serve as a homeroom/small group leader for 8 campers OR be part of the team that runs carpool lines and the technical needs of our daily Noontime Show.
132,"Mural Arts Program Assistant, Summer",Sitar Arts Center,"Remote in Washington, DC 20009",,"5+ Years working mural artist or visual artist working is acrylic paint.Lead technical drawing and painting workshops, provide guidance and support."
133,Writer/Producer,Wondrium,"Remote in Chantilly, VA 20151",,"In addition, the role performs project management tasks for project completion, such as providing direction to editors, graphic artists, and other technical…"
134,newProduction Designer,NEI,"Washington, DC 20004 (Penn Quarter area)",,Exceptional technical skills related to the production of a broad range of design deliverables.Minimum 5 years’ experience and demonstrated track record…
135,newProduction Designer,NEI,"Washington, DC 20004 (Penn Quarter area)",,Exceptional technical skills related to the production of a broad range of design deliverables.Minimum 5 years’ experience and demonstrated track record…
136,"newCompany Manager, Folger Theatre",Folger Shakespeare Library,"Washington, DC 20003 (Capitol Hill area)",,"Manages all aspects of housing for visiting artists and scholars:Oversees all travel arrangements of theater artists and actors, and others involved in…"
137,Design Center & Custom Framing Sales Associate,Blick Art Materials,"Washington, DC 20005 (Downtown area)",,"The Design Center Associate is responsible for driving revenue by providing excellent customer service, knowledge of Fine Art Printing, Archival Framing and an…"
138,Graphic Artist,"ANALYGENCE, Inc.","Remote in Arlington, VA",,Familiar working with technical professionals and other SMEs.ANALYGENCE works with customers to develop and execute innovative strategies to improve processes…
139,newProduction Tech,City Winery Washington DC,"Washington, DC 20002 (Capitol Hill area)",,Adapt to colleague requests and fellow staff feedback for technical show requirements.Act as primary point of contact for artists and management upon arrival…
140,Web Content Manager,"Venesco, LLC","Arlington, VA",,"Bachelor’s degree in English, journalism or mass communication or related field and demonstrated technical competency.Experience in web page design."
141,newSenior Instructional Design Specialist,JBS International,"North Bethesda, MD 20852",,"Ability to work closely with SMEs, graphic artists, programmers, media developers, and technical writers to develop instructionally sound and engaging learning…"
142,Sr. Graphic Artist/ Executive Level Presentations,MOSAIC Technologies Group,"Annapolis Junction, MD 20701",,"MOSAIC is seeking a Graphic Artist/ Executive Presentations designer support a prime contract in the Annapolis Junction, MD area."
143,Senior Strategic Communications Graphic Artist and Designer,"Freedom Information Systems, Inc.","Washington, DC 20546 (Southwest Federal Center area)",,Ability to analyze complex technical information and communicate to a non-technical and/or external audience.The position requires advanced graphics skills and…
144,"Director, County Initiatives",REFORM Alliance,"Washington, DC",,Oversee design of technical assistance resources to support pilots and demonstrations of innovative program models.
145,"newDirector, Creative Services",BBB National Programs Inc,"McLean, VA 22102",,"Consult and provide expertise in the definition of project scope and objectives, involving all relevant stakeholders and ensuring technical feasibility."
146,Engineering and Maintenance Manager,Glenstone Museum,"Potomac, MD 20854",,Completion of a four-year vocational/technical high school program or technical/mechanical trade apprentice program and five years electrical and/or mechanical…
147,Design and Visualization Specialist,Foursquare ITP,"Washington, DC 20005 (Logan Circle area)",,"Foursquare ITP is a leading transportation and transit planning company looking for a qualified, motivated, and passionate candidate for an entry-level design…"
148,"Wardrobe Crew (Seasonal, late May to mid-August)",Wolf Trap Foundation For The Performing Arts,"Vienna, VA 22182",,Must be able to work all technical rehearsals and performances.Wolf Trap Foundation is monitoring and adhering to current federal and state guidelines for…
149,Video Production Director,Wondrium,"Chantilly, VA 20151",,Ensure all media is recorded and meets technical quality requirements and established deadlines.Coach on-screen talent in best-practices for delivering…
